{
  "id": "rehaozhenyin",
  "number": 272,
  "name": "熱耗真陰證",
  "category": "溫病證候",
  "overview": "熱耗真陰證是指溫邪羈延，日久不解，深入下焦，劫灼肝腎之陰所出現的一系列虛多邪少證候。\n主要臨床表現為：身熱面赤，手足心熱甚於手足背，口燥咽乾，心中動悸，神倦耳聾，脈虛大或結代。\n熱耗真陰證常見於“風溫”、“春溫”、“暑溫”等溫病的後期。\n本證應與“陰虛火旺證”、“邪留陰分證”、“亡陰脫液證”等相鑑別。",
  "clinical_manifestations": "身熱面赤，手足心熱甚於手足背，口燥咽乾，心中動悸，神倦耳聾，脈虛大或結代。熱耗真陰證",
  "common_diseases": [
    "“風溫”",
    "“春溫”",
    "“暑溫”等溫病的後期。"
  ],
  "differential_syndromes": [
    "“陰虛火旺證”",
    "“邪留陰分證”",
    "“亡陰脫液證”"
  ],
  "differential": {
    "self_analysis": "溫邪為患，最易傷陰，故熱耗真陰證常見於多種溫病的後期。而春溫、風溫、暑溫、溫疫等疾病中尤易出現。春溫病多伏邪為患，里熱甚重，病情延久，邪傳下焦，每易耗傷陰液；風溫為風熱相合，暑溫為陽熱之邪，溫疫則系疫邪為患，火毒熾盛，均易傷陰耗液。具體表現如下：春溫熱耗真陰證，症見身熱，口乾，手足心熱甚於手足背，神倦，脈虛等；若舌燥耳聾，乃腎精大虧，真陰欲竭，宜滋補真陰，方用加减复脉汤(《溫病条辨》)。若已見手足蠕動，舌絳苔少等，為肝腎之陰俱耗，水不涵木，虛風內動，須滋陰潛陽，方用二甲复脉汤(《溫病条辨》)。風溫，溫熱，溫疫，溫毒，冬溫等，若邪在陽明久羈，脈沉實轉為脈虛大，壯熱轉為發熱稽留，手足心熱甚於手足背；煩渴轉為口乾苔燥，反不甚渴，此為邪熱深入下焦，耗傷真陰，均宜復脈湯加減。若心中憺憺而動，脈細促者，為陰虛水虧，虛風內擾，宜滋陰潛陽，鎮肝熄風，方用三甲复脉汤(《溫病条辨》)。若已見手足抽搐，瘛瘲，時時欲脫者，為陰虛不斂，虛陽上擾，急宜滋陰固脫，潛陽熄風，方用大定风珠(《溫病条辨》)。暑溫熱耗真陰證，症見心熱煩躁，消渴不已，舌紅絳，苔黃燥者，為水火不濟，須滋腎水，清心火，方用连梅汤(《溫病条辨》)。\n陰虛之人易患溫病，須防邪熱直入下焦，劫灼真陰，葉天士曾說：“或其人腎水素虧，雖未及下焦，先自徬徨矣。必驗之於舌，如甘寒之中加入鹹寒，務在先安未受邪之地，恐其陷入易易耳”。氣陰兩虛之人感受溫熱而為病，或誤用辛溫表藥，劫津液，耗心氣，症見心中震震，汗泄不止等陽氣欲脫之象，若治療失當，則陰陽兩脫而莫救。本證在陽虛之人或誤下之後，如見大便溏泄者，不宜大劑滋膩，恐其滑潤助泄，宜滋陰養液與澀腸止泄並施。溫病至此，陰液將竭，留得一分津液，便有一分生機，執此大綱，統籌全局，則不致貽誤。",
    "type_comparison": "陰虛火旺證與熱耗真陰證 兩者均為溫病後期所出現的陰液不足而有邪熱稽留的證候。但陰虛火旺證是真陰不足，壯火復熾，邪熱灼陰，水虧火旺，水火不能相濟，故以心煩不得眠為特徵；熱耗真陰證則是陰虛失養，虛熱內生，津不上承，神失所養，正氣虛衰，故以手足心熱甚於手足背，口乾舌燥，神倦欲眠等為特徵。陰虛火旺證虛實相兼，故舌紅而苔黃，熱耗真陰證虛多實少，故舌乾絳無苔或少苔，二者不難區別。\n邪留陰分證與熱耗真陰證 二者都有陰分之傷，而熱邪未淨。但大意相同，程度有別：邪留陰分證，邪多而陰傷較輕，以夜熱早涼，熱退無汗，能食形瘦等為特徵。吳鞠通所謂“夜行陰分而熱，日行陽分而涼，邪氣深伏陰分可知”；其治法“不能純用養陰”，“更不得任用苦燥”(《溫病条辨·下焦篇》)，而以滋陰透邪為大法；熱耗真陰證則以肝腎陰傷，虛風欲動為主要表現，以滋陰潛陽，鎮肝熄風為治則。\n亡陰脫液證與熱耗真陰證 二者同屬溫邪深入下焦，劫灼肝血腎精。但亡陰脫液證較熱耗真陰證病勢嚴重，既可因溫邪久羈，吸灼真陰所致，亦可因誤行辛溫發汗或誤用攻下，導致津液精血脫失而成，臨床主要表現為熱深厥深，舌乾齒黑，唇裂，脈細促，手指蠕動，心中憺憺大動，或心中痛，時時欲脫等，其邪氣已去八、九，真陰僅存一、二，故見全身機能衰竭之象。熱耗真陰證則餘熱之邪未盡，故見低熱，手足心熱等，兩者以此為辨。"
  },
  "literature": "《溫病条辨·下焦篇》：“風溫，溫熱，溫疫，溫毒，冬溫，邪在陽明久羈，或已下，或未下，身熱面赤，口乾舌燥，甚則齒黑唇裂，脈沉實者，仍可下之；脈虛大，手足心熱甚於手足背者，加減復脈湯主之。”\n“溫病誤表，津液被劫，心中震震，舌強神昏，宜復脈法，復其津液。舌上津回則生；汗自出，中無所主者，救逆湯主之。”\n“溫病耳聾，病系少陰，與柴胡湯者必死。六、七日以後，宜復脈輩復其精。”\n“勞倦內傷，復感溫病，六、七日以外不解者，宜復脈法。”\n“溫病已汗而不得汗，已下而熱不退，六，七日以外，脈尚躁盛者，重與復脈湯。”\n“溫病誤用升散，脈結代，甚則脈兩至者，重與復脈，雖有他證，後治之。”\n“汗下後，口燥咽乾，神倦欲眠，舌赤苔老，與復脈湯。”\n“下焦濕病，但大便溏者，即與一甲復脈湯。”\n“熱邪深入下焦，脈沉數，舌乾齒黑，手指但覺蠕動，急防痙厥，二甲復脈湯主之。”"
}