{
  "id": "taiyangyingshangjingmaishiyang",
  "number": 336,
  "name": "太陽營傷經脈失養證",
  "category": "傷寒證候",
  "overview": "太陽營傷經脈失養證是太陽表證施以汗法，傷及營血，不能濡養經脈致身體疼痛的證候。\n主要臨床表現為：發汗之後，表證已解，而見身疼痛，舌苔薄白，脈沉遲等。\n太陽營傷經脈失養證常見於“太陽病”之中，亦常見於“風濕痺病”等疾病中。\n此證應與“太陽表實證”、“太陽表虛證”、“太陽表寒里熱證”、“太陽風濕相搏證”進行鑑別。",
  "clinical_manifestations": "發汗之後，表證已解，而見身疼痛，舌苔薄白，脈沉遲等。太陽營傷經脈失養證",
  "common_diseases": [
    "“太陽病”之中，亦常見於“風濕痺病”"
  ],
  "differential_syndromes": [
    "“太陽表實證”",
    "“太陽表虛證”",
    "“太陽表寒里熱證”",
    "“太陽風濕相搏證”進行"
  ],
  "differential": {
    "self_analysis": "身痛，六經病證中皆可出現，但其臨床表現各有特點。一般來講，三陽證身痛，多是表邪為患，三陰經身痛，則里寒多見。《傷寒論》說：“發汗後，身疼痛，脈沉遲者，桂枝加芍藥生薑各一兩人參三兩新加湯主之。”本證原為太陽表證，經發汗後，表證雖解，但身疼痛不除，且脈由浮緊而變為沉遲。此乃發汗而使營陰損傷，陰液虧耗，以致營血不足，不能濡養周身，身不得營血之濡養，故疼痛不休；脈沉主里，沉遲並見，亦為營血不足之象。尤在涇曰：“發汗後邪痺於外而營虛於內，故身痛不除，而脈轉沉遲。《經》曰：其脈沉者，營氣微也。又曰：遲者營氣不足，血少故也。”說明了本證身疼痛，為汗後營虛血少，不能榮行脈中，是以周身作痛，治當補營陰而益衛氣，宜桂枝新加汤(《傷寒論》)調和營衛，益氣和營，則身痛自癒。若發汗後，身疼痛，脈浮緊或浮數，而不見沉遲之象，又無傷營之徵兆，此乃發汗未徹，表邪未得盡解之故。仍當發汗解表，宜桂枝汤(《傷寒論》)。若發汗後身痛，脈見沉遲，又服桂枝新加湯而不癒者，恐有衛陽不運之故，治療可用新加湯加附子，在和營陰的基礎上，兼以復陽(《傷寒溯源集》)，或投以桂枝加附子汤(《傷寒論》)調和營衛，溫經回陽。此法為先救其陽，俾陽復津回，津回則營自充，其身疼則癒。若汗後傷營身痛而兼氣虛者，宜和營益氣為佳，當與黄芪建中汤(《金匱要略》)。若見惡寒蜷臥，手足厥冷，脈沉微細等症，則當急救回陽，宜四逆汤(《傷寒論》)。總之，發汗後出現之身疼痛，雖以營氣不足血少而多見，而營傷及衛，乃至陽虛陰盛之證，亦復不少。",
    "type_comparison": "太陽表實證與太陽營傷經脈失養證 太陽表實證與汗後營傷經脈失養證，均屬太陽病，又皆有明顯的身痛症狀，具有一定的鑑別意義。前者為風寒襲表，衛陽外閉，營陰鬱滯，經氣不能暢通運行，因之身痛腰疼，骨節疼痛等，但不同於汗後傷營經脈失養證。因太陽表實證見於太陽病未汗之前，有發熱惡寒，無汗而喘等表現，為其主要特徵。太陽營傷經脈失養證為發汗傷營所致，既有使用汗法之過程，又有脈沉且遲等營血不足之象，據此不難鑑別。\n太陽表虛證與太陽營傷經脈失養證 太陽表虛證之身痛見於太陽中風之初，因風邪襲表，營衛失和，太陽經氣不暢，故致身痛。又風為陽邪，其性疏泄，損傷肌表，則使肌腠疏鬆，故雖見身痛，其勢較輕，並伴有翕翕發熱，嗇嗇惡寒，淅淅惡風，微微自汗等表虛症狀，有別於汗後傷營經脈失養證。而太陽營傷經脈失養證是汗後表解營傷而成。前者表虛脈浮緩，後者營傷脈沉遲；前者表邪為患，後者營血不充。\n太陽表寒里熱證與太陽營傷經脈失養證 太陽表寒里熱乃是太陽表實的兼證，見於《傷寒論》：“太陽中風，脈浮緊，發熱惡寒，身疼痛，不汗出而煩躁者，大青龙汤主之”。緣於風寒束表，不汗出而陽鬱，鬱久化熱所致。故外見表寒不解，內則鬱熱已成，所以表現為發熱惡寒，身疼痛，不汗出而煩躁，脈浮緊等現象。太陽營傷經脈失養證之身痛，其勢較緩，並有乏力倦怠，肌膜疏鬆之感。以脈象言，前者浮緊；後者沉遲，更可區分。\n太陽風濕相搏證與太陽營傷經脈失養證 太陽風濕相搏證是風與濕邪合併為病。風為陽邪，風淫所勝，則周身痛煩；濕為陰邪，濕淫所勝，則肢體沉重，難於轉側。故《傷寒論》指出：“傷寒八九日，風濕相搏，身體疼煩，不能自轉側，不嘔不渴，脈浮虛而澀”。而太陽傷營經脈失養證之身痛，既非煩疼，也不沉重，且能自轉側。"
  },
  "literature": "《註解傷寒論·辨太陽病脈證並治法第六》：“汗後身疼痛，邪氣未盡也。脈沉遲，榮血不足也。經曰：其脈沉者，榮氣微也。又曰：遲者，榮氣不足，血少故也。與桂枝湯以解未盡之邪，加芍藥、生姜、人參、以益不足之血。”\n《傷寒緒論·身疼痛》：“有里證身疼者，乃直中里證，非傳經里證也。若傳經里證則屬熱，熱主血行，又何有身痛哉，然直中身疼者，寒氣直入於里，陽已內衰，不能外通，而氣血凝滯，故令體痛，宜急溫之。凡有頭痛發熱，而身痛如縛者，表證也；無頭痛發熱，而身痛如杖者，直中也。”\n《傷寒大白·身痛》：“身痛之症，六經皆有，三陽身痛，皆是表邪；三陰身痛，皆是里寒。”\n《傷寒溯源集·太陽上篇》：“此本中風而以麻黃湯誤發其汗，遂成陽氣虛損，陰液耗竭，不能充灌滋養，故身疼痛而脈沉遲，非傷寒脈浮緊而身疼痛之可比也……仍以桂枝湯和解衛陽。因誤汗之後，多加芍藥之酸收，以斂營陰之汗液，生姜以宣通其衰微之陽氣，人參以扶助其耗散之元真，故名之曰桂枝新加湯。然身疼痛而脈沉遲皆無陽之證，而不加附子以溫經復陽者，以未如肉瞤筋惕汗漏不止之甚，故不必真武湯，及桂枝加附子湯救急之法也，若服而未除者，恐亦必當加人也。”\n《醫宗金鑑·訂正傷寒論注》：“發汗後身疼痛，脈浮緊或浮數，乃發汗未徹，表邪未盡也。仍當汗之，宜桂枝湯。今發汗後，身雖疼痛，脈見沉遲，是榮衛虛寒，故用桂枝新加湯溫補其榮衛也。”\n《傷寒論淺注·辨太陽病脈證篇》：“發汗後邪已淨矣。而身猶疼痛，為血虛無以榮身，且其脈沉遲者，沉則不浮，不浮則非表邪矣。遲則不數緊，不數緊則非表邪之疼痛矣，以桂枝加芍藥生姜各一兩、人參三兩新加湯主之，俾血運則病癒。”"
}