{
  "id": "xiaoerxinjingshire",
  "number": 402,
  "name": "小兒心經實熱證",
  "category": "專科證候",
  "overview": "小兒心經實熱證多因外感溫邪，入里化熱，導致心神不寧，以及與心經有關的小腸、舌等器官病變的證候。\n主要臨床表現為：驚悸不寧，夜寐不安，舌紅腫或潰爛，小便短赤，或發熱或不發熱，舌苔黃，脈數。\n小兒心經實熱證常見於“驚悸”、“不寐”、“吐舌”、“舌瘡”等疾病中。\n本證應與“小兒心胃實熱證”、“小兒小腸實熱證”相鑑別。",
  "clinical_manifestations": "驚悸不寧，夜寐不安，舌紅腫或潰爛，小便短赤，或發熱或不發熱，舌苔黃，脈數。小兒心經實熱證",
  "common_diseases": [
    "“驚悸”",
    "“不寐”",
    "“吐舌”",
    "“舌瘡”"
  ],
  "differential_syndromes": [
    "“小兒心胃實熱證”",
    "“小兒小腸實熱證”"
  ],
  "differential": {
    "self_analysis": "小兒心經實熱證，見於多種疾病中，其臨床表現各不相同，歸納起來可分二類：一類是心經本身的病變，如驚悸病，臨床以心悸不安，心煩口渴，舌質紅絳為特點，治應清熱寧心，方用清宮湯(《溫病條辨》)；再如不寐病，必兼躁擾不安，多夢，頭暈舌赤，治應清心安神，方選加味導赤散(《幼幼集成》)合瀉心散(《小兒藥證直訣》)。一類是舌病，因心氣通於舌，心經實熱最易引起舌病，如吐舌病，其舌伸長而收緩，伴有面紅、煩躁、口渴、尿赤，治用瀉心導赤散(《醫宗金鑑》)；若舌瘡病，見心經實熱證，其舌尖生瘡或潰爛，由於心經積熱，熏蒸於舌所致，治用瀉心導赤散。",
    "type_comparison": "小兒心胃實熱證與小兒心經實熱證 此兩證病性、病位相同，故臨床表現極為相似，均可見舌病(包括腫脹、疼痛、潰爛)、尿赤、心煩不眠、心悸不寧。但小兒心胃實熱證，因胃有實熱，胃與脾相表里，脾之脈絡於舌，臟腑壅滯，故小兒心胃實熱證除見舌體腫大外，並見煩渴欲飲，大便秘結，發熱，這些乃胃實熱的臨床表現，以此可鑑別小兒心經實熱證。\n小兒小腸實熱證與小兒心經實熱證 心與小腸相表里，心經實熱可移熱於小腸，表現出小腸實熱的症狀，如尿赤、尿灼熱、尿痛等。但小兒心經實熱證必有心經本身的病變，如心悸、心煩、不眠等症，這是小腸實熱證沒有的。另小腸實熱證常伴有小便不利，大便粘滯，這是因小腸受熱不能正常分清化濁，從而影響膀胱、大腸的功能，導致大便粘滯，小便不利。這些病機是小兒心經實熱證所沒有的，故有助此兩證的鑑別。"
  },
  "literature": "《幼科鐵鏡·辨心實熱虛熱》：“心熱額色紅燥，或舌紅紫，或舌紅而腫，或小便赤，赤而澀，澀而痛，或燒熱，皆心熱也。”\n《小兒藥證直訣·心熱》：“視其睡，口中氣溫，或合面睡，及上竄咬牙，皆心熱也，導赤散主之。”\n《嬰童百問·重舌、木舌、弄舌》：“舌者心之候，脾之脈絡於舌也，臟腑壅滯，心脾積熱，熱氣上衝，故令舌腫漸漸脹大，塞滿口中，是為木舌。”"
}