{
  "id": "dachangbugu",
  "number": 226,
  "name": "大腸不固證",
  "category": "臟腑證候",
  "overview": "大腸不固證是指大腸傳化物的功能失常，導致糞便糟粕從大腸直瀉而出的證候。大腸不固證多由於先天不足，或久病大病之後，中氣不足而致。\n主要臨床表現為：大便呈水樣，便頻量多，精神衰憊，四肢困倦，不思飲食，舌淡苔白，脈沉細無力。\n大腸不固證常見於“中暑”、“霍亂”、“泄瀉”等病中。\n本證應與脾氣下陷證、大腸虛寒證相鑑別。",
  "clinical_manifestations": "大便呈水樣，便頻量多，精神衰憊，四肢困倦，不思飲食，舌淡苔白，脈沉細無力。大腸不固證",
  "common_diseases": [
    "“中暑”",
    "“霍亂”",
    "“泄瀉”等病"
  ],
  "differential_syndromes": [
    "脾氣下陷證",
    "大腸虛寒證"
  ],
  "differential": {
    "self_analysis": "大腸不固證在不同的疾病中表現各有特點。在中暑中表現為暑熱大汗，腹瀉嘔吐不止，精神不振，四肢倦怠，甚或四末不溫，出現厥逆危候，脈微欲絕屬中暑陰證，治宜益氣固脫為法，方用生脉散(《備急千金要方》)合参附龙牡汤(《世醫得效方》)或回阳救急汤(《重訂通俗傷寒論》)。本證在霍亂中表現為劇烈而頻繁的嘔吐腹瀉，下利清稀或如米泔水樣，臭穢酸腐，腹痛或不痛，胸脘滿悶，四肢困倦無力，舌苔膩，脈濡滑，治宜辟穢泄濁，方用燃照汤加減(《霍亂論》)。大腸不固證在泄瀉中表現為大便次數增多，每日三、五次以至十數次或更多，大便清稀如注，或完谷不化，腹痛腸鳴，納少倦怠，舌淡苔白，脈細弱，是為脾虛濕盛，治宜健脾利濕，方用参苓白术散加減(《和劑局方》)。",
    "type_comparison": "脾氣下陷證與大腸不固證 大腸不固證是由於脾氣不足，大腸傳化功能失常，以大便直趨泄下為主要症狀，而脾氣下陷證是脾虛清陽不舉反而下陷，除可表現為泄瀉外，還可出現久痢、脫肛、崩漏、子宫脫垂等症，是其鑑別要點。\n大腸不固證與大腸虛寒證 大腸不固證是氣虛不固，除大便清稀或如水注外，尚有肢倦乏力，納少神疲等症，而大腸虛寒證屬陽虛證候，主要表現為腹冷痛，得溫痛減，四末不溫，腸鳴腹瀉，此是其鑑別要點。"
  },
  "literature": "《古今醫鑑·泄瀉》：“夫泄瀉者，注下之症也，蓋大腸為傳導之官，脾胃為水谷之海，或為飲食生冷之所傷，或為暑濕風寒之所感，脾胃停滯，以致闌門清濁不分，發注於下，而為泄瀉。”"
}