{
  "id": "shirezhengbi",
  "number": 446,
  "name": "濕熱蒸鼻證",
  "category": "專科證候",
  "overview": "濕熱蒸鼻證是濕熱之邪犯肺，肺氣壅滯，濕熱濁邪上蒸鼻竅而出現的一組臨床表現。病因可由嗜酒辛辣，脾胃蘊熱，外感邪氣，肺經鬱熱所致。\n主要臨床表現為：鼻痛鼻癢，黃水浸淫，鼻塞重，涕黃濁量多，鼻前庭粘膜潮紅、糜爛、結痂，黃水滲出，鼻甲充血腫脹明顯，或有息肉，伴頭重，胸悶，腹脹，舌紅，苔黃膩，脈滑數。\n本證常見於“鼻疳”、“鼻息肉”、“鼻淵”等。\n本證應與“肺經鬱熱證”鑑別。",
  "clinical_manifestations": "鼻痛鼻癢，黃水浸淫，鼻塞重，涕黃濁量多，鼻前庭粘膜潮紅、糜爛、結痂，黃水滲出，鼻甲充血腫脹明顯，或有息肉，伴頭重，胸悶，腹脹，舌紅，苔黃膩，脈滑數。",
  "common_diseases": [
    "“鼻疳”",
    "“鼻息肉”",
    "“鼻淵”"
  ],
  "differential_syndromes": [
    "“肺經鬱熱證”"
  ],
  "differential": {
    "self_analysis": "本證為外感濕熱，或飲食不節，脾胃失調，濕濁不化，鬱生濕熱，濕熱之邪犯肺，循經上犯鼻竅，蒸灼肌膚竅膜所致，所犯鼻中部位不同，臨床表現各異。如鼻疳之濕熱蒸鼻證，見鼻內灼熱癢痛，鼻前孔肌膚潮紅，糜爛結痂，黃水浸淫，滲液，多因素有濕熱內鬱，風熱之邪外侵，內外合邪，熏蒸鼻竅肌膚所致。《雜病源流犀燭》卷二十三：“脾胃有熱移於肺中”，“口鼻生疳蝕爛亦為肺脾胃三經之熱”，治宜化濕清熱，解毒散結，方用萆薢滲濕湯(《瘍科心得集》)加減。如鼻息肉之濕熱蒸鼻證，見持續鼻塞膿涕，鼻道可見淡紅，暗濁息肉阻塞，多因濕熱邪毒侵襲，肺經熱盛，肺氣不得宣暢，濕熱邪濁壅結積聚鼻竅所致，《外科正宗·鼻痔》云：“鼻痔者，為肺氣不清，風熱鬱滯而成。”治宜清宣肺熱，利濕散結，方用辛夷清肺飲(《醫宗金鑑》)合三仁湯(《温病條辨》)加減。如鼻淵之濕熱蒸鼻證，見鼻涕黃濁而量多，滑滑流出，味臭，鼻塞重，嗅覺差，鼻內肌膜紅腫脹甚，鼻道見膿涕，多因濕熱內蘊，犯於肺經，上蒸鼻竇清竅，治宜清熱利濕，化濁通竅，方用甘露消毒丹(《温病條辨》)。",
    "type_comparison": "肺經鬱熱犯鼻證與濕熱蒸鼻證：二者皆為熱證實證，然病因病理有異，臨床表現不同。前者因復感風熱之邪，或肺虛邪侵，熱鬱於肺，邪熱上犯鼻竅，經脈氣血失調所致，表現為鼻內腫痛，灼熱乾燥，鼻塞稠涕，竅內粘膜紅腫，或潰爛出血，口渴欲飲，苔黃，脈實而數。後者為外受風濕，濕熱之邪，或脾胃失調，濕熱內蘊，濕熱之邪循肺經上犯鼻竅，熏蒸粘膜所致，因濕之特性，故以潮紅、糜爛、滲液、涕濁量多、苔膩、脈滑濡為特點，臨床當以鑑別。"
  },
  "literature": "《外科啟玄·卷八》：“凡鼻孔有痔瘡，即肺中有濕熱，治宜除肺中濕熱，外以搽藥，若不早治，恐蝕其鼻內關竅，令人言語不明。”\n《張氏醫通・鼻息肉》：“痛極而不下垂者為息肉。此血熱勝也。鼻痔則有物下垂而不痛，乃濕熱勝也。”"
}