{
  "id": "xiaoerxinqikuixu",
  "number": 410,
  "name": "小兒心氣虧虛證",
  "category": "專科證候",
  "overview": "小兒心氣虧虛證是由心臟功能活動減弱所引起的心神不寧，智力發育障礙的證候。小兒心氣虧虛證可由先天稟賦不足或後天失養所引起。\n主要臨床表現為：心悸氣短，膽小易驚，精神疲倦，或有自汗，面白色淡，脈弱，或見智力不健，語言發育遲緩。\n小兒心氣虧虛證可出現在“小兒五遲”、“小兒心悸”等疾病中。\n本證應與“小兒心脾兩虛證”、“小兒心氣陰兩虛證”相鑑別。",
  "clinical_manifestations": "心悸氣短，膽小易驚，精神疲倦，或有自汗，面白色淡，脈弱，或見智力不健，語言發育遲緩。小兒心氣虧虛證可出現在“小兒五遲”、“小兒心悸”等疾病中。",
  "common_diseases": [],
  "differential_syndromes": [
    "“小兒心脾兩虛證”",
    "“小兒心氣陰兩虛證”"
  ],
  "differential": {
    "self_analysis": "小兒心氣虧虛證多由於先天稟賦不足，心氣虧虛；或後天餵養不當，氣血生化乏源；或久病不已，耗傷氣血；或失血過度，營血內竭，氣隨血耗；或誤汗損傷心氣、心陽，從而導致本證。小兒心氣虧虛證在不同的疾病中可有不同的表現。如心氣虧虛證在小兒五遲中的臨床特點為：面色晄白，智力不健，神情呆鈍，語言發育遲緩，雖屬言語之時，尚不能說話，舌質色淡，脈細弱。心主神明，言為心聲，小兒心氣不足，則智力發育障礙，雖至會語之時，亦不能如期說話，而為語遲。治宜益心氣，通神竅，養心血，方用菖蒲丸(《醫宗金鑑》)。心氣虧虛證在小兒心悸中的臨床特點為：心悸怔忡，動則尤甚，膽小易驚，神疲乏力，自汗懶言，面色無華，或訴頭暈，或作嘆息，舌淡苔白，脈細弱或沉遲，虛里搏動弱。氣為血帥，氣行則血行，心氣不足，鼓動無力，悸動不安。治宜養心益氣，安神定悸，方用四君子汤(《和劑局方》)加味。\n小兒有“陽常有餘，陰常不足”、“脾常不足”等生理特點，及病情變化迅速的病理特點，小兒心氣虧虛證在發展過程中，常可演變為心氣陰兩虛證、心脾兩虛證。其治療除補益心氣外，還要注意滋養心陰，健運脾氣。\n由於小兒心氣虧虛，在臨床上邪毒常易自肌表先犯肺衛後，再犯心脈，損傷心之陰陽氣血，從而失去心主血脈的功能，血行不暢，瘀阻於內，則見心悸、怔忡、脈結代等症，此時的治療既要清熱解毒，又要護心復脈。又有小兒先天稟賦心氣虧虛，心脈瘀阻，自幼即見面色晄白，心悸氣短，神疲乏力，唇口青紫，動則作喘，常因外感而使上述症狀加重，並屢屢誘發心陽虛衰而危及生命。",
    "type_comparison": "小兒心脾兩虛證與小兒心氣虧虛證 二者臨床均可見心悸，應予鑑別。小兒心脾兩虛證是指心血與脾氣虧虛，以致血不養心，脾失健運，脾氣不升，脾不統血而出現的證候，臨床見心悸，失眠，神疲，頭暈，健忘等心神不安的症狀，是由心血虛，血不養心所致；同時兼見脾虛的症狀：食少，腹脹，便溏等。小兒心氣虧虛證是由心氣不足，心臟功能活動減弱而引起的，臨床僅見心悸怔忡，動則尤甚，自汗懶言，神疲乏力，膽小易驚等心氣虛，心脈鼓動無力的症狀，臨床不難區分。\n小兒心氣陰兩虛證與小兒心氣虧虛證 二證均有心氣虛，臨床均可見心悸氣短，乏力自汗。但小兒心氣陰兩虛證是心氣不足，兼有心陰不足，臨床除有上述心氣虛的表現外，還兼見心陰虛的表現，如顴紅盗汗，舌苔花剝，脈細數，治療應氣陰雙補，臨床不難區分。"
  },
  "literature": "《保嬰撮要·卷五·語遲》“錢氏云，心之聲為言，小兒四五歲不能言者，由妊母卒有驚動，邪乘兒心，致心氣不足，故不能言也。”\n《小兒衛生總微論方·卷第二·五氣論》“心氣怯者，則性痴而語遲，髮久不生，生則不黑。心主血，髮為血之餘，怯則久不生也。心系舌之本，怯則語遲也。”\n《小兒藥證直訣·卷上·脈法證治》“心主驚……虛則臥而悸動不安。”"
}