{
  "id": "xiaoerfenghanshubiao",
  "number": 393,
  "name": "小兒風寒束表證",
  "category": "專科證候",
  "overview": "小兒風寒束表證是指外感風寒之邪，侵犯人體，正邪相爭於肌表而引起的證候。\n主要臨床表現為：惡寒重，發熱輕，頭痛身痛，無汗，舌苔薄白，脈浮緊。\n小兒風寒束表證常見於“感冒”、“喘咳”、“頓咳”等疾病中。\n本證應與“小兒風溫束表證”相鑑別。",
  "clinical_manifestations": "惡寒重，發熱輕，頭痛身痛，無汗，舌苔薄白，脈浮緊。小兒風寒束表證",
  "common_diseases": [
    "“感冒”",
    "“喘咳”",
    "“頓咳”"
  ],
  "differential_syndromes": [
    "“小兒風溫束表證”"
  ],
  "differential": {
    "self_analysis": "小兒風寒束表證，是外感風寒之邪侵犯肌表，所引起的證候，發生在多種疾病的初期，臨床各有一定特點。如感冒病出現風寒束表證，則多表現為惡寒重，發熱輕，頭痛身痛，鼻塞流涕，噴嚏，咳嗽，喉癢，無汗，舌苔薄白，脈浮緊，指紋浮紅，此為外感時邪，風寒外束之故，法宜辛溫解表，方用葱豉汤(《肘後方》)，咳嗽痰多者可用杏苏散(《溫病条辨》)。又如小兒喘咳，是嬰幼兒常見病，多發病，其臨床表現為惡寒發熱，身痛無汗，嗆咳氣急，鼻翼煽動，舌苔薄白或白膩，脈象浮緊。此為外感風寒，寒邪閉肺所致，法宜宣肺解表，方用三拗汤(《和劑局方》)合葱豉汤(《肘後方》)。若頓咳見風寒束表證，臨床表現為陣發性咳嗽，尤以夜間為甚，且見鼻塞流涕，痰色稀白，面白唇淡，舌淡苔白，脈浮無力，指紋青淡。此乃風寒閉肺，肺失清肅，法宜辛溫宣肺，方用止嗽散(《醫學心悟》)加麻黃、蘇葉等。\n小兒臟腑嬌嫩，形氣未充，衛外機能不固，時行疾病易為感染，因此風寒束表證，在兒科疾病中比較多見，且有些疾病如頓咳等只在十歲以下兒童間傳染。\n風寒束表證，發病之因是風寒之邪，寒邪屬陰，易傷陽氣，如果風寒侵犯肌表，衛外機能不固，病機演化大致有如下幾方面的趨勢，一為寒邪入里，鬱久化熱，從而轉屬陽明，症見但熱不惡寒，反惡熱，口渴，脈浮滑；一為汗、下太過，損傷津液，外邪入里，化熱化燥，以致脾胃津液損傷，而致大便秘結，症見汗出表不解，蒸蒸發熱；一為平素中氣虛弱，重感於寒，每易轉為脾胃虛寒的證候，症見發熱，灑淅惡風，身痛，肢體倦怠，食少腹脹，便瀉；一為素稟陽虛，始病即見虛寒，症見微發熱，惡寒，身痛不解，脈微細，但欲寐等。",
    "type_comparison": "小兒風溫束表證與小兒風寒束表證 二證均屬“表證”，但兩者病因病機不同。小兒風溫束表證，發病之因為感受溫熱邪毒，多由口鼻而入，邪襲太陰肺經，病理機轉為熱邪為病易於傷陰，且表證短暫，傳變較為迅速；小兒風寒束表證，發病之因為風寒之邪，多由皮毛而入，邪襲太陽膀胱經，病理機轉為寒為陰邪，易於傷陽，且寒邪留戀在表，然後化熱入里，傳變較為緩慢，因此臨床表現亦有所區別。其證候鑑別點為：前者，初起惡寒輕，發熱重，且伴有口微渴，無汗或少汗，苔雖白而舌邊尖紅赤，脈浮而數；後者，初起惡寒重，發熱輕，常兼見頭痛身痛，無汗，舌苔薄白，舌質正常，脈浮而緊等。"
  },
  "literature": "《幼幼集成·乳子傷寒證治》：“夫癸腎內藏真陽，與壬膀為表里，今癸水真陽未足，則壬水清寒，故寒邪之來，各從其類，竟趨太陽寒水之經，以寒召寒，誠莫能御，所以小兒傷寒為最多。今謂其無傷寒，不幾令小兒之病傷寒者，束手待斃，皆死非命乎，非小兒無傷寒，因其榮血未充，易於生熱，治之不當，即變為痉，幼科指為驚風者，即此是也。然小兒傷寒，貴於急治，但不宜發表，由其肌膚薄，腠理疏，恐致汗多亡陽，若能於初起之時，即為解肌，祛其表邪從外而出，則必無變痉之虞矣。”"
}