{
  "id": "yangmingjing",
  "number": 289,
  "name": "陽明經證",
  "category": "傷寒證候",
  "overview": "陽明經證是指邪熱亢盛於陽明本經，而腸中無燥屎內結的證候。本證多因患者陽氣素旺，感受外邪之後，旋即化熱入里，或病在太陽不解，隨經轉屬於陽明，或過用辛溫發汗劑，汗出過多，或早用攻下，耗傷津液，促使熱邪內並於陽明。\n主要臨床表現，以身大熱，汗大出，口大渴，脈洪大(或浮滑)四大證為主要特點。其它可見到面赤或面垢，氣粗而喘，舌苔薄黃乾燥，甚則心煩躁擾，谵語遺尿，或昏睡等。\n陽明經證常見於“春溫”、“暑溫”、“溫瘧”、“冬溫”等疾病中。\n本證應與“胃熱證”、“太陽熱多寒少證”、“陽明腑實證”相鑑別。",
  "clinical_manifestations": "",
  "common_diseases": [
    "“春溫”",
    "“暑溫”",
    "“溫瘧”",
    "“冬溫”"
  ],
  "differential_syndromes": [
    "“胃熱證”",
    "“太陽熱多寒少證”",
    "“陽明腑實證”"
  ],
  "differential": {
    "self_analysis": "《傷寒論》中的陽明經證並非局限於感寒而發的狹義傷寒，凡六淫所致的外感熱性疾病均可見到陽明經證。它們在具備陽明經證的主要症狀的共性中，又各具一定特點，治法亦略不同，故須加以辨析。《傷寒論》中的陽明經證有白虎湯證與白虎加人參湯證的不同。白虎湯證是熱邪充斥內外，表里俱熱的一種證候，以大熱、大汗、大渴、脈洪大為辨證要點，其中尤以煩渴和汗出為使用本方的主要依據。白虎加人參湯證則是熱邪耗傷氣陰的證候，它既有口乾舌燥，煩渴特甚，以至“欲飲水數升”的傷陰症狀，又有時時惡風，背微惡寒，脈大而芤的耗氣症狀。所以仲景不單用白虎湯清泄里熱，還加人參益氣生津，以冀熱清而正復。如果春溫病出現陽明經證，則臨床以但熱不惡寒，煩渴加重，病發於立春後夏至前為特點，此乃伏氣內發，失於清解所致。正如吳鞠通所說：“溫邪之熱與陽明之熱相搏，故但惡熱也。”治宜辛涼泄熱，甘寒救津，方用新加白虎汤(《通俗傷寒論》)。若陽明經證見於暑溫病，其暑熱鬱蒸，濕氣氤氳，暑濕蒸騰於氣分，則表現為身熱，汗出，口渴不多飲，身倦體痛，舌苔白膩，脈多濡數。治宜辛涼清熱，苦溫燥濕，方用白虎加苍术汤(《溫病条辨》)。若陽明經證見於溫瘧，則表現為先熱後寒，熱多寒少，頭痛如破，骨節煩疼，心煩出汗，時時作嘔，無苔少津，脈多弦。其寒熱休作，發病定時為特點。此由風寒之邪內伏，復受暑濕熏蒸或勞碌過度而作。治宜清熱保津，佐以解肌透邪，方用白虎加桂枝汤(《溫病条辨》)。若冬溫病中出現陽明經證，則以口渴，煩熱，自汗，脈洪大，並有咳嗽，脅疼為特點。冬溫乃冬季的新感溫病，溫毒入里有傷肺傷胃之別。素體胃陰不足的邪偏重於胃，臨證以煩熱，脈洪而咳為主，治宜辛涼清氣，佐以宣肺，白虎湯為主方，可酌加杏仁、桑葉、連翹等；若素體肺陰不足的邪偏重於肺，臨證以發熱，口渴，咳嗽脅疼，甚則呃逆為主，治宜辛涼清肺，佐以清胃，方用桑菊饮(《溫病条辨》)加石膏、知母、貝母、鬱金、杷葉。總之，陽明經證常隨季節的變化而表現不同的特異性。臨床可根據六淫各主其時的太過與不及，以及體質的強弱進行辨證論治。\n就其時令而言，陽明經證以春夏兩季多見。蓋春主風，夏主暑，風暑屬陽，性動而散，其中尤以暑氣多從火變，最易耗傷氣陰。風熱或暑邪侵犯肌表，入里化熱蒸灼津液，很快會出現陽明經證。大凡奔走於烈日之下的陽亢陰虧之質，多罹患此證。\n陽明經證為陽證、熱證、實證。但發展到嚴重階段，也會出現真熱假寒的厥證。症見胸腹灼熱而手足厥冷。這是由於陽明熱極，陽鬱於內而不能達於四末所致。《傷寒論》中所說的“厥深者熱亦深，厥微者熱亦微”，即是熱厥證。若將四肢厥冷診為寒證而誤投辛溫剛燥之品，則陰津涸竭，危殆立至，臨證不可不慎。",
    "type_comparison": "胃熱證與陽明經證 胃為燥土，喜潤惡燥。若過食炙煿辛辣之物或肝鬱化火，皆會耗傷胃陰而出現胃熱證。輕則胃中嘈雜、口臭齦腫，重則口渴引飲，消谷善飢，脈洪大，舌苔黃，質少津。後者與陽明經證有類同。若細審二證，卻有明顯不同。在症狀上，胃熱證多不伴有發熱，且出汗不多，而陽明經證必伴發熱，並大汗出；在病因上，胃熱證多不能明訴起因，而陽明經證有明顯的外因可查；在病程上，胃熱證可遷延數月或數年，而陽明經證僅有數天或數小時。再參之脈象的洪大與否，舌苔乾燥程度，則更易區別。\n太陽熱多寒少證與陽明經證 太陽中風服桂枝湯本屬正法，但須遍身漐漐微似有汗為佳，若服桂枝湯後，汗出如水，脈洪大者，病必有變。或未離太陽之表，仍從太陽論治，此即太陽熱多寒少證；或為汗不得法，病由太陽入於陽明，即變為陽明經證。若不細審，誤將大汗出、脈洪大的未離太陽之表的熱多寒少證診為陽明經證，治之必成壞病。鑑別之點在於：陽明經證之脈洪大、汗大出，必有煩渴引飲，舌苔黃燥等里熱證；而太陽熱多寒少證的汗大出、脈洪大，必無煩躁，且有惡寒、頭項痛等表證存在。正如《醫宗金鑑》所說：“服桂枝湯，大汗出病不解，脈洪大，若煩渴者則為表邪已入陽明，是白虎湯證。今脈雖洪大而不煩渴，則為表邪仍在太陽，當更與桂枝湯如前法也。”\n陽明腑實證與陽明經證 兩者均屬里熱實證，並均可見到煩渴、汗出、神昏、谵語等里熱熾盛症狀。但若將治療陽明經證的白虎湯類方投於陽明腑實證，則病重藥輕，不濟於事；若將治療陽明腑實證的承氣湯類方投於陽明經證，則藥過病所，必成壞證。因此，臨證不可不審。其根本區別在於：陽明腑實證是有形之實邪內結，故必有腹滿痛拒按的燥結症狀；陽明經證是無形之里熱亢盛而無實邪內結，故無腹滿痛拒按的症狀，以此為辨，便可了然。"
  },
  "literature": "《傷寒論類方匯參》：“類白虎證誤用白虎必死辨\n白虎證，生死在反掌之間，苟非重用石膏，必無挽回之理，然病情變幻疑似有二：\n(一)血虛象白虎證。\n其狀肌熱燥熱，口渴引飲，其脈洪大，按之全無，此血虛發熱之證，東垣以當歸補血湯治之。\n季云按熱渴引飲，同於白虎證，脈洪大，類似白虎證。惟重按全無，則獨異於白虎證也。\n全生集載：久病陰虛，發熱惡寒，午後兩頰焮赤，煩躁引飲，肌熱躁熱，至夜尤甚，脈洪大，按之無力，此皆血虛而煩躁也。用當歸補血湯。\n(二)氣虛類白虎證。\n如丹溪治鄭義門，秋間大熱，口渴，妄言妄見，脈洪數而實。視其形肥，面赤帶白，卻喜露筋，脈本不實，涼藥所致，與黃芪附子湯，冷飲之，三帖後困倦鼾睡，微汗而解，脈亦稍軟。繼以芪朮湯調治而安。\n季云按丹溪所辨在形肥面帶白色，故知為素稟陽虛之證，然脈洪數而實，則又類於白虎證也，辨之尤難。\n以上二證，辨別最要之點在皆無汗，故知非白虎證。傷寒論云：發熱無汗，其表不解者，不可與白虎湯。徐靈溪亦云：“無汗”二字最為白虎所忌，用方者不可不知。”"
}