{
  "id": "roulunqixu",
  "number": 452,
  "name": "肉輪氣虛證",
  "category": "專科證候",
  "overview": "肉輪氣虛證是指脾胃虛弱，運化失職，中氣不足而出現的胞瞼開闔失司，水濕上泛等肉輪病變的概稱。多因勞倦過度，飲食傷脾，或久病脾虛氣弱所致。\n主要臨床表現為：胞瞼沉重，開啟無力，甚則不能升舉，或胞瞼虛浮，每遇勞倦之後症情加重；全身可見面色萎黃，神疲乏力，氣短懶言，納呆便溏，舌淡苔白，脈細弱。\n肉輪氣虛證常見於“上胞下垂”，“胞虛如球”等疾病中。\n本證通常應與“肉輪氣虛風熱證”、“肉輪脾虛肝旺證”、“肉輪脾虛濕熱證”等相鑑別。",
  "clinical_manifestations": "胞瞼沉重，開啟無力，甚則不能升舉，或胞瞼虛浮，每遇勞倦之後症情加重；全身可見面色萎黃，神疲乏力，氣短懶言，納呆便溏，舌淡苔白，脈細弱。肉輪氣虛證",
  "common_diseases": [
    "“上胞下垂”，“胞虛如球”"
  ],
  "differential_syndromes": [
    "“肉輪氣虛風熱證”",
    "“肉輪脾虛肝旺證”",
    "“肉輪脾虛濕熱證”"
  ],
  "differential": {
    "self_analysis": "肉輪氣虛證可出現於多種眼病之中，但其臨床表現各具一定特點，治法亦不盡相同，應該加以辨析。如在上胞下垂病中出現肉輪氣虛證，則多表現為一眼或雙眼上胞瞼低垂，覆蓋黑睛，啟瞼無力，或需抬眉仰首，方可瞻視，甚者需以手拈起眼皮方能視物，久則垂覆越下。一般晨起稍輕，午後較重。全身可見氣短懶言，神疲體倦等症。此由素體虛弱，飲食不節，內傷脾氣，升降失司所致。治宜補中益氣，健脾升陽，方用補中益氣湯(《脾胃論》)。若在胞虛如球病中出現肉輪氣虛證，臨床表現：多以雙眼同時發病，眼胞虛腫浮起，皮色不變，按之柔軟不痛，如以擦熱之手掌，輕拭胞瞼，則虛腫漸消，但去之很快又恢復如故。平時睜眼乏力，不耐久視，面色萎黃，神疲倦怠。此因脾虛氣弱，虛風所乘，清陽之氣難升，濁陰之氣不降所致。治宜補中益氣，祛風升陽，方用助陽和血湯(《蘭室秘藏》)。總之，在以上兩病中，證候雖然相同，但其症狀表現各有特色，臨床可根據上述特點，加以辨析。",
    "type_comparison": "肉輪氣虛風熱證與肉輪氣虛證 根據“邪之所湊，其氣必虛”的理論，肉輪氣虛風熱證與肉輪氣虛證，在病机上有一定聯繫，但又有區別。前者是由脾虛氣弱，肉輪失養，衛氣衰憊，風熱之邪侵及胞瞼所致。臨床表現胞瞼痙攣緊澀，甚則瞼緣內翻，睫毛倒入，摩擦睛珠，刺痒疼痛，羞明眵淚，白睛紅赤，上胞重墜，開啟無力，早晨輕減，午後垂重，或每遇勞倦過度之後更甚。而肉輪氣虛證無眼皮緊急，倒睫拳毛，刺痒疼痛，羞明流淚，白睛紅赤等風熱所侵之見證。一屬虛中挟實之候，一為脾虛氣陷，無實象可見，以此可資鑑別。\n肉輪脾虛肝旺證與肉輪氣虛證 肉輪脾虛肝旺證與肉輪氣虛證在病机上既有聯繫又有區別。前者因飲食不節，損傷脾胃，脾虛則氣血虛衰，肝體失養，肝陽偏亢，肝風乘於胞瞼所致，臨床常見兩目頻頻眨動，白睛微紅，或入暮不見，煩躁善怒，夜睡不寧，面色萎黃，神疲乏力，納呆便溏等肝強脾弱之症。而肉輪氣虛證，無肝體失養，肝氣過盛，肝風入目之證象可見，兩者自是不同。\n肉輪脾虛濕熱證與肉輪氣虛證 脾主肌肉，胞瞼內應於脾。肉輪脾虛濕熱證，乃因飲食勞倦，七情憂思，傷損脾胃，脾虛氣弱，不能上榮於胞瞼，則腠理不密，脾虛濕熱內生，留滯胞瞼所致。臨床可見眼瞼局部輕度腫脹，色微紅，以手指觸之有小的腫核，疼痛輕微，可作膿排出，多為時起時消，反覆發作，日久不愈，或一目愈後另一目又生，或雙目同時反覆發作，全身兼見脾虛氣弱，胃納不佳，消化較差等見證。肉輪氣虛之胞瞼虛腫如球，用手按之可平，無紅赤疼痛及肉腐作膿等濕熱郁蒸之象，可助鑑別。"
  },
  "literature": "《諸病源候論·卷二十一》：“目是臟腑血氣之精華，肝之外候，然五臟六腑之血氣，皆上榮於目也。若血氣虛則膚腠開而受風，風客於瞼膚之間，所以其皮緩縱，垂复於目則不能開，世呼為睢目，亦名侵風。”"
}