{
  "id": "shaoyinyangxuyinsheng",
  "number": 305,
  "name": "少陰陽虛陰盛證",
  "category": "傷寒證候",
  "overview": "少陰陽虛陰盛證是指少陰病陽氣衰沉，陰寒內盛的候。多因寒邪直接侵入少陰，或由太陽、太陰發病邪傳少陰所致。傷寒誤治，正氣受傷，邪陷少陰，亦可形成陽虛陰盛之證。\n主要臨床表現為：神疲欲寐，四肢厥冷，下利嘔吐，甚則下利清谷，畏寒蜷臥，大汗出，腹痛，舌淡，苔白滑，脈沉細。\n少陰陽虛陰盛常見於“少陰病”、“霍亂”、“嘔吐”、“腹痛”等疾病中。\n本證應與“少陰陰盛格陽證”、“少陰陰盛戴陽證”、“寒邪犯胃濁陰上逆證”、“厥陰血虛寒鬱證”相鑑別。",
  "clinical_manifestations": "神疲欲寐，四肢厥冷，下利嘔吐，甚則下利清谷，畏寒蜷臥，大汗出，腹痛，舌淡，苔白滑，脈沉細。少陰陽虛陰盛",
  "common_diseases": [
    "“少陰病”",
    "“霍亂”",
    "“嘔吐”",
    "“腹痛”"
  ],
  "differential_syndromes": [
    "“少陰陰盛格陽證”",
    "“少陰陰盛戴陽證”",
    "“寒邪犯胃濁陰上逆證”",
    "“厥陰血虛寒鬱證”"
  ],
  "differential": {
    "self_analysis": "少陰陽虛陰盛證，見於《傷寒論》少陰病，以吐利、下利清谷、惡寒厥逆等為主，此乃少陰陽氣衰弱，陰寒內盛而致，治以急救回陽，方宜四逆汤(《傷寒論》)。本證又可見於霍亂病，則多呈吐瀉不止，吐出瀉下之物如米泔汁，面色蒼白，目眶下陷，四肢逆冷，汗出轉筋拘急，舌淡，苔白滑，脈微細等症。乃飲食不潔，穢濁在中，脾胃受損，升降失司，陰寒內盛，陽氣衰疲所致。治宜溫中扶陽，方用理中丸(《傷寒論》)。如嘔吐而見陽虛陰盛證，多呈嘔吐不止，目眶下陷，四肢厥逆，神疲氣短，舌淡，脈微弱。乃寒邪直中太陰，波及少陰，氣隨液脫所致。急宜回陽救逆，方用附子理中丸(《和劑局方》)。如腹痛而見陽虛陰盛證，多呈臍下疼痛，畏寒，四肢逆冷，男子縮陰，女子縮乳等症。乃寒邪直中少陰，或腎經陰寒極盛所致。急宜回陽救逆，溫腎散寒，予大劑真武汤(《傷寒論》)。\n少陰陽虛陰盛證多見於陽氣素虛之人。素體陽虛者，常由外邪直中而致少陰陽虛陰盛證。小兒若見此證，主要表現為遺尿，肢體惡寒，小便清長等症；婦女若見此證，主要表現為經行泄瀉，帶多色白而質清稀，畏寒肢冷，不孕等症。臨床當辨證論治。",
    "type_comparison": "少陰陰盛格陽證與少陰陽虛陰盛證 兩者均有四肢厥冷，下利清谷等表現。少陰陽虛陰盛證除四肢厥冷，下利清谷的主症以外，必兼見頭面大汗出，汗出如珠而粘膩。此因陽虛陰盛，陽氣衰微，氣脫液隨，汗液未經陽氣溫煦蒸化，故汗出如珠粘膩，陽氣外亡，其勢向上，故頭面多汗，但無熱象，軀幹四肢無汗，病勢危重。少陰陰盛格陽證，除四肢逆冷，下利清谷的主症以外，兼見身熱不惡寒等症。此因寒盛於里，陽氣外散所致，乃真寒假熱之徵，宜用通脈四逆湯通達內外之陽氣：少陰陽虛陰盛證，脈象微細，而少陰陰盛格陽證，脈微欲絕。可見後者病勢較前者為重。\n少陰陰盛戴陽證與少陰陽虛陰盛證 兩者同有四肢厥冷，下利清谷，脈微細等表現，究其病機，陽虛陰盛證乃心腎陽衰，陰寒內盛。陰盛戴陽證乃陰寒內盛，虛陽被陰寒格拒於上，故除四肢厥冷，下利清谷，脈微細等症以外，必兼面赤。宜用白通汤(《傷寒論》)宣通上下陽氣。\n寒邪犯胃濁陰上逆證與少陰陽虛陰盛證 寒邪犯胃濁陰上逆證即吳茱萸湯證，它與少陰陽虛陰盛證同有四肢厥冷，脈微細等表現，但吳茱萸湯證乃少陰感寒，寒邪一時性的鬱遏陽氣，不能溫養四肢，故四肢厥冷而脈微細，與少陰陽虛陰盛證出現四肢厥冷，脈微細的病機截然不同。吳茱萸湯證還兼見乾嘔，吐涎沫，頭痛等症。乃陰盛陽鬱，濁氣上逆所致，宜用吴茱萸汤(《傷寒論》)溫胃散寒，降逆止嘔。\n厥陰血虛寒鬱證與少陰陽虛陰盛證 兩者均有手足厥冷，脈微細等表現，但病因病機不同。血虛寒鬱證，乃血虛之人，寒邪凝滯，氣血運行不暢，四肢失於溫養，故四肢厥冷而脈微細，宜用当归四逆汤(《傷寒論》)養血散寒，溫通經絡。若兼見嘔吐，乃胃寒宿飲，應酌加吳茱萸、生薑溫中祛寒，降逆和胃。少陰陽虛陰盛證的病機為陽氣衰沉，陰寒內盛，必見腹痛，下利清谷等症，可資鑑別。"
  },
  "literature": "《傷寒論翼·少陰病解第五》：“其腹痛下利，小便不利者，有水火之分。若四肢沉重疼痛，為有水氣，是陽虛而不勝陰也。若便膿血與泄利下重者，此為火鬱，是陽邪陷入於陰中也。下利清谷，里寒外熱，手足厥逆，脈微欲絕，身反不惡寒，其人面赤者，是下虛而格陽也。吐利兼作，手足逆冷，煩躁欲死者，是陰極而發躁也。歧伯曰：‘陰病治陽，陽病治陰，定其中外，各守其鄉。’此即仲景治少陰之大法也。”\n《傷寒解惑論·少陰病中解》：“四逆湯的作用，主要是溫太陰，因此用來治少陰病，就有它的局限性。譬如火虛的程度，已出現全身性症狀，而且又較為嚴重的時候，就嫌病重藥輕，必須改用通脈四逆湯。這些全身性的嚴重症狀：一是脈微欲絕；二是四肢厥逆反周身汗出；三是格陽外熱，身反不惡寒。這些症狀，只要出現其中之一，就表示陽氣即將斷滅，或即將脫散，就必須改用通脉四逆汤，即四逆湯倍乾薑，並加大附子用量，以急救亡陽。”\n《傷寒挈要·少陰病證治》：“少陰病虛寒或胸中寒實，均可見吐逆。但由於有虛實之不同，故其脈症表現及治法各異。若初病即見脈弦遲，手足寒，弦脈主飲，遲脈主寒；寒飲阻格，陽氣不達四末而致手足寒，此為胸中寒實上逆而作吐。寒飲在上，因其高而越之，當治以吐法，因勢利導，不能用瀉下的方法治療。若屬少陰虛寒，陽虛失溫，水飲不化，水寒之氣逆於膈上，見欲吐不吐，乾嘔者，就不能用吐法治療，當用四逆湯扶陽以抑陰。\n按：少陰虛寒之四逆湯證，除見嘔逆外，常伴有下利清谷，畏寒，厥逆，脈微等證，自當與胸中寒實不同，臨證時當仔細辨別。”"
}