{
  "id": "shuiluntoufengtanhuo",
  "number": 483,
  "name": "水輪頭風痰火證",
  "category": "專科證候",
  "overview": "水輪頭風痰火證是指肝風與痰火相搏，上犯頭目，而出現的清陽諸竅被擾，痰火上逆以及頭風攻痛等臨床表現的概稱。多因過度疲勞，憂思悲泣，或忿怒暴悖，喜食辛熱，嗜酒恣燥等所致。\n主要臨床表現：眼脹痛連及鼻根部及眼眶骨酸痛，頭痛，噁心嘔吐，視燈火有虹視現象，瞳神散大，眼壓增高，舌紅苔白或黃，脈弦或弦數。\n水輪頭風痰火證常見於“青風內障”、“綠風內障”、“雷頭風內障”等疾病中。\n本證通常應與“水輪肝膽風火證”、“水輪頭風痰濕證”相鑑別。",
  "clinical_manifestations": "",
  "common_diseases": [
    "“青風內障”",
    "“綠風內障”",
    "“雷頭風內障”"
  ],
  "differential_syndromes": [
    "“水輪肝膽風火證”",
    "“水輪頭風痰濕證”"
  ],
  "differential": {
    "self_analysis": "水輪頭風痰火證可出現於多種眼病之中，其臨床表現各具一定特點，治法亦不盡相同，必須加以辨析。\n青風內障：出現水輪頭風痰火證則多表現為輕度頭痛，痛在太陽及前額部，眼球脹痛，瞳神呈淡青色，視物模糊，視燈火有虹視現象，常在晚間發作，有時經適當休息或情緒平靜之後可自行緩解。此由肝氣偏旺，痰火上逆，清竅受擾所致。如《審視瑤函·青風內障》謂：“陰虛血少之人，及竭勞心思，憂鬱忿恚用意太過者，每有此患，然無頭風痰氣火攻者，則無此患。”治宜清肝瀉火祛風止痛，方用青風羚羊湯(《醫宗金鑑》)。\n綠風內障：出現水輪頭風痰火證，其臨床表現每以頭痛，眼脹痛，黑睛呈哈氣樣水腫，瞳神散大，呈淡綠氣色，視物模糊，抱輪紅赤，眼壓較高，前房變淺等特點。此由肝風痰火升擾，上乘清竅，熏蒸瞳神所致。如《證治準繩·七竅門》謂：“雖頭風所致，亦由痰濕所攻，火鬱憂思忿怒之過，若傷寒瘧疫熱蒸，先散瞳神而後綠後黃。”治宜涼肝熄風，清化痰火，方用羚羊角散(《世醫得效方》)。\n雷頭風：出現水輪頭風痰火證，常為突然發病，頭痛如劈，目脹欲脫，瞳神散大，視力下降，甚則全無光感，眼壓升高，小便赤澀，大便秘結為特點，此由肝風上凌，痰火僭越，清陽被擾，頭風攻痛所致。治宜瀉火息風，方用大承氣湯(《傷寒論》)。\n總之，以上證候雖然相同，但在不同疾病中，其症狀表現各有一定特點，可以辨析。",
    "type_comparison": "水輪肝膽風火證與水輪頭風痰火證：水輪肝膽風火證的形成，常由暴怒忿鬱，傷及肝膽，肝膽之氣橫逆，火氣上擾清竅，熱甚生風所致。臨床可見眉棱骨痛，目珠脹酸，不能久視，怕光喜暗，甚則頭痛目赤，口苦咽乾，脅痛，大便乾燥，舌紅苔黃，脈弦數等症狀。而水輪頭風痰火證以痰火上炎，蒸灼瞳神為重點，故臨床除了頭風攻痛的症狀外，尚有瞳神散大，氣色混濁，或青或綠，眼壓升高，視力下降等症狀比較突出。\n水輪頭風痰濕證與水輪頭風痰火證：水濕不運，聚而成痰，則為濕痰，濕痰久蘊，若從火化，則為痰火，皆可上凌頭目。二者在病機上既有聯繫，又有區別。水輪頭風痰濕證多為飲食不節，脾胃有傷，不能運濕，濕痰上逆，清陽被擾，目竅受損所致，臨床以偏頭痛，同側眼睛視力受害，昏渺眩暈，腹滿不食，腹痛便溏，苔白脈濡等表現為主症，與水輪頭風痰火證之目珠脹痛，瞳神散大及氣色改變等痰火炎蒸之象，顯然不同。"
  },
  "literature": "《聖濟總錄》卷一百六：“肝氣通於目，目者肝之官，又五臟六腑之精氣，皆上注於目。然目有五輪，內應五臟，而骨之精為瞳人，筋之精為黑睛，若肝腎熱實，或上膈壅滯，風邪毒氣上攻於目，皆令目睛疼痛。”\n《審視瑤函・內外二障論》：“夫目屬肝，肝之怒，怒則火動痰生，痰火阻隔肝膽脈道，則通光之竅遂閉，是以二目昏蒙，如煙如霧，目一昏花，愈生鬱悶。故云：久病生鬱，久鬱生病。今治者，不近此理，俱執一偏之論，惟言肝腎之虛，正以補肝補腎之劑投之，其肝膽脈道之邪氣一得其補，愈盛愈蔽，至目日昏，藥之無效，良由通光脈道之瘀塞耳。”\n《目經大成》：“大小雷頭風：此證不論偏正頭風，但憎寒壯熱，狀如傷寒，頭目疙瘩，腫痛極，不能忍耐者是。或挾痰而來，兩耳若雷鳴風動，轟轟作聲，故曰雷頭風。風起目隨病，既而身如被杖，二便秘結，曰大雷頭風。頭風作，大便先潤後燥，小便先清長後赤澀，身熱徐退不痛，曰小雷頭風。大者害速，小者稍緩，二三日目即損壞，神醫莫能為治。……初起不問大小雷頭風，三陽厥逆，五邪爭並，不辨為火、為風、為痰，脈息對症或否，速與三承氣，或三黃祛熱煎，火得息則痰自散，而風亦漸止。”"
}