{
  "id": "shaoyinyangxushuifan",
  "number": 307,
  "name": "少陰陽虛水泛證",
  "category": "傷寒證候",
  "overview": "少陰陽虛水泛證是指少陰病陽虛陰甚，水氣內停而出現的證候。多因少陰病不解，陰寒之邪逐漸深入，陽氣為之虛衰，或素體陽虛，或久病及腎，陽虛不能化氣行水所致。\n主要臨床表現為：神疲欲寐，頭眩，心下悸，腹痛，小便不利，四肢沉重，浮腫下利，苔白滑，脈微細。\n少陰陽虛水泛證可見於“少陰病”或“咳嗽”、“哮喘”、“心悸”、“胸痛”、“臌脹”、“水腫”等疾病中。\n本證應與“少陰陽虛寒凝證”、“太陽水氣上逆證”相鑑別。",
  "clinical_manifestations": "神疲欲寐，頭眩，心下悸，腹痛，小便不利，四肢沉重，浮腫下利，苔白滑，脈微細。少陰陽虛水泛證",
  "common_diseases": [
    "“少陰病”或“咳嗽”",
    "“哮喘”",
    "“心悸”",
    "“胸痛”",
    "“臌脹”",
    "“水腫”"
  ],
  "differential_syndromes": [
    "“少陰陽虛寒凝證”",
    "“太陽水氣上逆證”"
  ],
  "differential": {
    "self_analysis": "少陰陽虛水泛證見於《傷寒論》“少陰病，二三日不已，至四五日，腹痛，小便不利，四肢沉重疼痛，自下利者，此為有水氣。其人或咳，或小便利，或下利，或嘔者，真武湯主之”。臨床上亦可用于多種疾病，如慢性咳嗽累及少陰，出現陽虛水泛證，則多見咳嗽反覆發作，痰涎清稀，畏寒，頭眩，肢體沉重，小便不利的症狀。皆由咳嗽日久，母病及子，腎為水火之臟，腎陽虛衰不能化氣行水，水氣內停為飲，上泛於肺，肺失清肅，咳嗽因之而作。治宜溫陽散寒，化氣蠲飲，方用真武汤(《傷寒論》)，苓桂术甘汤(《傷寒論》)。如哮喘出現陽虛水泛之證，則多表現為畏寒神疲，氣喘，動則哮喘加重，喉中痰鳴，四肢厥冷汗出，浮腫的特點。此由哮喘日久，傷及腎氣，腎不納氣，陽虛生外寒，命火不足，不能化氣行水所致。治宜補腎納氣，方用黑锡丹(《和劑局方》)。如心悸病出現陽虛水泛證，則多表現為神疲心悸，畏寒肢冷，小便不利，渴不欲飲的特點。此由於腎陽虛衰，不能制水，水氣凌心，膀胱氣化失司所致。治宜溫陽益氣，化氣行水，方用苓桂术甘汤(《傷寒論》)。如胸痛病出現陽虛水泛證，則多表現為心前區疼痛，形寒肢冷，四肢沉重，腰膝酸痛，腹瀉便溏，脈沉無力或見結代等特點。此由陽虛血脈痺阻，陽虛火不生土，脾失健運，水濕內停所致。喻嘉言謂：“胸痺，因陽虛，故陰得乘之。”宜溫陽化飲，補氣行水，方用桂枝人参汤(《傷寒論》)。如泄瀉病出現陽虛水泛證，則多表現為黎明腹瀉，腸中鳴響，瀉後則安，畏寒神疲的特點。此由命火虛衰，火不生土，水濕內停所致。治宜補火生土，方用四神丸(《婦人良方》)。如“臌脹”病出現陽虛水泛證，則多表現為神疲，頭面四肢浮腫，腹中臌脹，手足逆冷，小便極少的特點。此山腎陽虛衰，膀胱氣化不利，不能化氣行水，方用济生肾气丸(《濟生方》)。如癃閉病出現陽虛水泛證，則多表現為神疲肢冷，浮腫，小便閉澀的特點。此由腎陽不足，氣不化水，水氣內停所致。治宜溫補腎陽，通利小便，方用金匮肾气丸(《金匱要略》)。如水腫病出現陽虛水泛證，則多表現為面目浮腫，腰以下腫勢尤甚，神疲畏寒，肢體逆冷的特點。此由於命門火衰，陰寒內盛，水不化氣所致。治宜溫腎化氣行水，方用真武汤(《傷寒論》)。臨床上可根據上述病證的特點，加以辨析。\n本證常因素體陽虛或病後失治而成，致陽虛陰盛，水飲內停，侵潰人體上中下三焦各部，症狀表現不盡相同，但以浮腫、心悸、頭眩等為主要症狀。\n少陰寒化證候，往往導致水氣為患，足少陰腎為寒水之臟，陽衰陰盛，水氣不化而為患，其病深重，須未雨綢繆，事先預防。水腫病日久不愈，若見唇黑，缺盆、腳心、人中、腹臍等腫而平滿，或肚腹見紅絲赤縷，為五臟俱傷，預後不良。若疾病更進一步發展，出現腹脹氣喘，嘔吐噁心，厭食，便溏洩閉，此為脾腎兩敗，多致不救。",
    "type_comparison": "少陰陽虛寒凝證與少陰陽虛水泛證 兩證同為少陰寒化證候，其病因病機十分相似，但在病位、症狀表現上亦有一定的區別。兩者同為腎陽不足，水氣不能蒸化，水濕之邪留而為患。少陰陽虛寒凝證乃腎陽虛兼脾濕，寒邪鬱滯，留著於骨節經絡處，其證以惡寒，身痛，脈沉為主要見症；少陰陽虛水泛證乃腎陽虛不能化水，水氣泛濫，溢於人體上中下三焦，以頭眩，心悸，浮腫為主要見症。兩證在治法上迥異。\n太陽水氣上逆證與少陰陽虛水泛證 兩證在病因上均為陽虛水停，同有頭眩、身搖晃不能自持之症狀。《傷寒論》云：“傷寒，若吐若下後，心下逆滿，氣上衝胸，起則頭眩，脈沉緊，發汗則動經，身為振振搖者，茯苓桂枝白術甘草湯主之。”邪在太陽當用汗法，今誤用吐下，傷及中洲脾胃之陽，中虛水氣上逆，上蒙清陽，頭為諸陽之會故起則頭眩。水飲病誤用汗法，導致陽氣虛，經脈失養，故身體振搖不能自主。太陽水氣上逆證重點是脾，少陰陽虛水泛證重點在腎。少陰陽虛水泛證是腎陽不足，水濕內停。頭為陽，其頭眩，乃陽虛陰盛、陰邪上乘而致。陽氣不足，經脈失於充養，身體瞤動，站立不穩而欲倒地也。症情較太陽水氣上逆證為重。"
  },
  "literature": "《醫宗金鑑·訂正傷寒論注少陰全篇》：“論中，心下有水氣，發熱有汗，煩渴引飲，小便不利者，屬太陽中風，五苓散證也。發熱無汗，乾嘔不渴，小便不利者，屬太陽傷寒，小青龍湯證也。今少陰病，二三日不已，至四、五日腹痛下利，陰寒深矣。設小便是純寒而無水，乃附子湯證也。今小便不利，或咳或嘔，此為陰寒兼有水氣之證。……而不用五苓者，以非表熱之飲也；不用小青龍者，以非表寒之飲也；故惟主以真武湯，溫寒以制水也。”\n《傷寒論湯證新編·真武湯證類》：“關於水氣為病，本證中有數見。如五苓散證膀胱有水氣，小便不利，必煩渴引飲，發熱有汗為特徵，屬太陽中風；小青龍湯證心下有水氣，小便不利，必發熱無汗，乾嘔不渴，且兼咳喘為特徵，屬表寒里飲，為太陽傷寒證。真武湯證陽虛飲停，水飲可侵及上中下焦各部，以頭眩、心悸、浮腫為特徵，不難辨別。”\n《冉注傷寒論·辨少陰病脈證並治》：“金鑑曰：少陰屬腎，主水者也。少陰受邪，不能主水，上攻則咳，下攻則利，邪從寒化，真武湯證也；邪從熱化，豬苓湯證也。”"
}