{
  "id": "xuexu_waigan",
  "number": 50,
  "name": "血虛外感證",
  "category": "全身證候",
  "overview": "血虛外感證是指素體血虛，感受外邪，津液不能作汗達邪而引起的一系列臨床表現的外感證候。多因失血過多，新血一時未及補充，產後血虛，或內傷雜病，脾胃生化不足而致血液虧少，不能濡養，復感外邪所致。\n主要臨床表現為：頭痛身熱，微惡風寒，少汗或無汗，鼻塞流涕，乾咳少痰，頭暈目花，面白無華，指甲蒼白，心悸健忘，手足發麻，女子月經量少，唇舌淡，苔薄白，脈細或浮而無力。\n血虛外感證常見於“虛勞”、“產後痺”、“血證”等疾病而併發的感冒。\n本證應與“氣虛外感證”、“陰虛外感證”、“陽虛外感證”相鑑別。",
  "clinical_manifestations": "頭痛身熱，微惡風寒，少汗或無汗，鼻塞流涕，乾咳少痰，頭暈目花，面白無華，指甲蒼白，心悸健忘，手足發麻，女子月經量少，唇舌淡，苔薄白，脈細或浮而無力",
  "common_diseases": [],
  "differential_syndromes": [],
  "differential": {
    "self_analysis": "血虛外感證是素體血虛，或產後血虧，或失血之後，體內營血不足，百脈失於濡養，御邪能力下降，外邪乘虛而入，侵襲人體而引起的外感疾病。可併發於多種疾病中，其臨床表現各具一定特點，治療方法亦不盡相同，必須加以辨析。如虛勞之血虛外感證，臨床表現為頭痛，身熱，熱勢不甚，微寒，乾咳少痰，鼻塞流涕，無汗或少汗，面色無華，指甲蒼白，心悸，頭暈，舌淡，脈浮或細。由於素體血虛，感受外邪，正邪相爭，故身熱，熱勢不甚等症；外邪侵襲，肺氣失宜，竅道不利，故鼻塞流涕，乾咳少痰；血虛則汗液不足，故無汗或少汗。血虛感冒，數日不愈，耗傷陰血，心悸眩暈加重。治宜養血解表。方用蔥白七味飲(《外台秘要》)加減。產後痺之血虛外感證，臨床上表現為遍身關節疼痛，肢體痠楚、麻木，惡風寒，甚則筋脈攣急，頭暈耳鳴，心悸失眠，舌質淡，苔白或少苔，脈細弱或細數。由於育齡婦女在產褥期或產後百日內，由於機體虛弱，氣血不足，風寒濕邪極易乘虛而入，經絡痺阻，肢體、筋脈、關節失於濡潤，故遍身疼痛，肢體痠楚、麻木，甚則筋脈攣急，血液虧虛，無以上榮於腦，髓海空虛，故頭暈耳鳴；心血虛，心神失養，故心悸失眠。治宜益氣養血，活血祛風。方用黃芪桂枝五物汤(《金匱要略》)。血證之血虛外感證，臨床表現為各種出血，包括鼻衄、齒衄、咳血、吐血、便血、紫斑，頭暈心悸，同時兼有頭痛發熱，鼻塞流涕等外感症狀。由於失血過多，血虛氣虧，感受外邪，正邪相爭而致諸症。治宜涼血止血，疏風解表。方用玉女煎(《景岳全書》)合桑菊飲(《溫病条辨》)加減。\n血虛外感證較多發生於婦人。因為經、孕、胎、乳無不以血為本，而血為氣之母，氣為血之帥，二者相互依存，相互為用。氣血虧虛，衛外不固，且易感受風熱、燥熱之邪。此類患者往往感冒之後，纏綿不已，經久不愈，或反覆感冒，外邪亦可由表入里，使症狀加重，甚則變生他病。臨證診治還應辨其偏寒偏溫的不同，採取不同治法，方能證治相宜。",
    "type_comparison": "氣虛外感證與血虛外感證 二者均屬體虛外感，但二者病因病機有所不同，臨床表現各具特點，治法也不盡相同。氣虛外感證是由於素體氣虛，衛外不固，復感外邪，邪不易解，臨床上表現為惡寒較重，或發熱，熱事不高，汗出，鼻塞流涕，頭痛，肢體倦息無力，咳痰無力，舌質淡胖，邊有齒痕，苔薄，脈浮；而血虛外感證是由於血虛，復感外邪，津液不能作汗達邪而致微惡風寒，身熱，頭痛，無汗或少汗，乾咳少痰，面色蒼白，頭暈目花，舌淡，苔薄，脈細浮。二者均有外感表證，但前者素體氣虛，故兼有氣虛症狀，治宜益氣解表；而後者素體血虛，兼有血虛症狀，治宜養血解表。\n陽虛外感證與血虛外感證 二者均屬體虛外感，同有外邪束表症狀。陽虛外感證是指體內陽氣虧損，機體失卻溫煦、氣化等作用，復感風寒外邪，而表現為畏寒肢冷，四肢不溫，鼻流青涕，口淡不渴或渴喜熱飲，無汗，面色晄白，小便清長，舌淡胖，脈沉遲。血虛外感證是因素體血虛，機體失卻濡潤，復感外邪所致。臨床表現上，其惡風寒症狀不如陽虛外感證重。陽虛外感易感受風寒之邪，而血虛外感易感受風熱、燥熱之邪。前者表現為陽虛症狀兼見外感表現，治宜溫陽解表；後者是血虛症狀兼見外感表現，治宜養血解表。以此二者不難鑑別。\n陰虛外感證與血虛外感證 二者臨床表現極為相似，因為血屬陰，故均有陰血不足外感證的表現，如身熱，微惡風寒，少汗，鼻塞流涕，頭暈目昏等症，但陰虛外感證主要是由於津液精血等陰液虧少而無以濡養、滋潤，復感外邪而致的虛熱證候，臨床兼見形體消瘦，口燥咽乾，潮熱顴紅，五心煩熱，盗汗等症狀，治宜滋陰解表，這是二者的主要區別。"
  },
  "literature": "《證治匯補·血證》：“血虛者，其症朝涼暮熱，手足心熱，皮膚乾澀甲錯，唇白，女子月事前後不調，脈細無力，法宜補之。”\n《景岳全書·血證》：“血本陰精，不宜動也，而動則為病。血主營氣，不宜損也，而損則為病。”"
}