{
  "id": "baogongxuhan",
  "number": 381,
  "name": "胞宮虛寒證",
  "category": "專科證候",
  "overview": "胞宮虛寒證是指因稟賦不足，或房勞多產而致陽氣不足，胞宮失於溫養，氣血生化不及所引起的證候。\n主要臨床表現為：小腹不溫，喜熱喜按，綿綿作痛，月經或後期而來，或經行量少，或停閉不行，帶下量多，色白質稀，腰痛腿軟，畏寒肢冷，大便溏薄，舌淡苔薄，脈沉細無力或沉遲。\n胞宮虛寒證常見於“月經後期”、“月經過少”、“痛經”、“閉經”、“帶下”、“不孕”等疾病中。亦可見於“胎漏”、“妊娠腹痛”、“胎動不安”、“胎萎不長”、“墮胎”、“惡露不下”諸疾。\n本證應與“胞宮寒凝證”、“痰濕阻胞證”相鑑別。",
  "clinical_manifestations": "小腹不溫，喜熱喜按，綿綿作痛，月經或後期而來，或經行量少，或停閉不行，帶下量多，色白質稀，腰痛腿軟，畏寒肢冷，大便溏薄，舌淡苔薄，脈沉細無力或沉遲。胞宮虛寒證",
  "common_diseases": [
    "“月經後期”",
    "“月經過少”",
    "“痛經”",
    "“閉經”",
    "“帶下”",
    "“不孕”"
  ],
  "differential_syndromes": [
    "“胞宮寒凝證”",
    "“痰濕阻胞證”"
  ],
  "differential": {
    "self_analysis": "胞宮虛寒證是婦科特有證候之一。由於婦人特有的行經、胎孕、產育等特異生理功能活動，均為胞宮所主，故胞宮虛寒證可出現於經、帶、胎、產及婦人雜病等各種疾病中。然而，在不同的疾病中，其臨床表現又各具一定特點，故需詳加辨析。如出現於月經後期、月經過少病時，臨床表現常見月事延期而來，或錯後七、八天，或二、三月始一行，抑或如期來潮，唯經量明顯減少，或經行時間過短，甚至一、二日即淨，或僅來點滴即無，經色淺淡，經質稀薄，腰酸腿軟，腹痛綿綿，喜暖喜按等症。乃由陽氣素虛，胞宮失於溫煦，氣少血寒，生化不及所致。如《景岳全書·婦人規》云：“凡血寒者，經必後期而至，然血何以寒？亦惟陽氣不足，則寒從中生，而生化失期，即所謂寒也。”治宜扶陽溫宮，溫經養血，方用大营煎(《景岳全書》)；月經後期、月經過少之漸，每發展為閉經，故胞宮虛寒證亦常出現於閉經病中，但臨床表現常以月經後期、月經過少的表現為其特點，其治法、用藥亦如前述。痛經病若見到胞宮虛寒證時，臨床表現多為經行少腹綿綿作痛，得熱痛緩，喜揉喜按，經行量少，色淡質薄，肢冷便溏等陽虛血寒、血行遲滯之特點。蓋因陽氣不足，陰虛內寒由生，血遇寒則凝泣，加之陽氣虛衰，運血無力而致。《陳素庵婦科補解·調經門》云：“經已行，則血海空。血去多亡陰，則陽氣無輔。虛則生寒，故腹痛。”宜溫經養血，方用温经汤(《金匱要略》)。帶下病中如出現胞宮虛寒證候時，臨床表現多見帶下色白質稀，淋漓不斷，小腹不溫，陰冷等症。此因胞失溫煦，陰精不能化血，為濕為濁下注衝任所致。治法：溫陽止帶，方用内补丸(《女科切要》)；若不孕病中出現胞宮虛寒證，臨床表現為多年不孕，月經初潮一般較晚，常後期而行，或經量甚少，或時常閉經、需用藥方能來潮，經色晦暗，或如煙油之色，腰痛腿軟，性慾淡漠等症。內診可見胞宮小於正常人者多，亦為其特點。《葉氏女科證治·求嗣》說：“婦人不孕病源……有子宮虛冷而陽氣不能生化者。”治宜助陽暖宮，常用艾附暖宫丸(《仁齋直指方》)；若胎漏中見到胞宮虛寒證，臨床表現則見妊娠漏下，血色淡紅，量少，或下如黃豆汁，腰腹不溫，形寒肢冷，面色蒼白，唇舌淡暗等症狀。乃因陽虛胞寒，精血不足，胎失所養引起。治宜溫經暖宮，養血安胎，方用当归寄生汤(《濟陰綱目》)；妊娠腹痛出現胞宮虛寒證時，多表現為妊娠期間，小腹不時作痛且涼，腹脹等陽虛陰寒內盛之特點。緣由胞乏陽氣溫養，陰寒之氣壅遏於內，胎失所養而致。治宜暖宮散寒、扶陽抑陰，方用胶艾汤(《金匱要略》)；若胎漏與妊娠腹痛並見，則為胎動不安。胎動不安繼續發展，血量增多，腰腹疼痛加劇，常常導致胎墮，故胞宮虛寒證亦常出現於胎動不安及墮胎病中；胎萎不長病中亦可見到胞宮虛寒證候，其臨床表現為妊娠五、六月時，而子宮增大明顯小於正常妊娠月份大小。如《諸病源候論·婦人妊娠病諸候》所說：“若血氣虛損，胞臟冷者，胎則翳燥委伏不長。其狀，兒在胎都不轉動，日月雖滿，亦不能生，是其候也。而胎在內痿燥，其胎多死。”治宜溫胞養胎，方用长胎白术散(《葉氏女科證治》)。產後惡露不下病中若見胞宮虛寒證，則表現為惡露不下，或雖下量亦甚少，色紫暗，小腹冷痛脹滿，形寒肢冷，脈象細澀等敗濁瘀滯之象。《萬氏婦人科·產後章》云：“因子宮素冷，停滯不行，……此必小腹脹滿刺痛無時也。”治宜溫胞散寒，治血行瘀，方用生化汤(《傅青主女科》)加減。\n胞宮虛寒證見於青春期至絕經前之婦女。多因稟賦薄弱，孕產房勞損傷下元，胞宮陽虛陰盛，以致經、帶、胎、產諸疾由生。而童幼之女、老年之婦則見此證者甚鮮。本證候所見之腹痛，一般以溫暖季節較輕，寒冷時候為著。\n胞宮虛寒證，緣由陽氣不足，胞失溫煦所致。胞宮乃經行之所，惡露之源，寒則血行滯澀。故常常演變為虛寒挾瘀之證，而易引起癥瘕等疾；胞宮虛寒證因陽虛氣化不利，易挾濕濁內阻，又可形成寒濕瘀結之證，導致帶下、癥瘕等病。",
    "type_comparison": "胞宮寒凝證與胞宮虛寒證 二者均為胞宮有寒，但寒有標本虛實之不同。胞宮寒凝證乃標實本虛之證。經云：“邪之所湊，其氣必虛。”風寒直客胞宮，常乘經期、新產之時，胞宮空虛之際而襲之。故每以經、產之虛，為之誘因；胞宮虛寒證則為標本俱虛之證。其寒乃因陽虛而生，非風寒外邪所客，多因先天不足，或房勞多產所為。前者因寒邪客之，陽氣被鬱，血為寒凝，致血道否澀，血行不利；後者因陽虛生化不足，血室匱乏，致使血海不能按時盈溢。故二者之病因、病機有所不同。在多種疾病中，二者雖同以小腹不溫、疼痛，月經錯後，經行量少，或停閉不行為其主症，但前者多以絞痛，血色紫暗有塊為特徵，後者則以隱痛、墜痛，血色淺淡質稀為特徵，故二者之虛實可辨。\n痰濕阻胞證與胞宮虛寒證 胞宮為經行之所，胎孕之地，惡露之源。痰濕阻胞證與胞宮虛寒證，病所同一。並均以血行失期，血量過少，或經血不行為其主要表現，而且可同見於月經不調，不孕等病中。然前者因脾虛不運，水谷之精微不能上輸心肺化赤而為血，反停聚於內而為濕、為痰，復因痰濕壅滯，阻於胞宮胞脈而致；後者則因腎陽不振，陰寒內盛，胞失溫養，氣血生化不足，衝任虧虛所為。此乃二者所不同之處。從臨床表現特點而言，前者因痰濕泛濫，常令人形體肥胖；後者陽虛內寒，每使人小腹冷痛。若參以舌脈，二者不難辨別。"
  },
  "literature": "《金匱要略·婦人妊娠病脈證並治》：“婦人懷娠六、七月，脈弦發熱，其胎愈脹，腹痛惡寒者，少腹如扇，所以然者，子臟開故也，當以附子湯溫其臟。”\n《金匱要略·婦人雜病脈證並治》：“婦人之病，因虛、積冷、結氣，為諸經水斷絕，至有歷年，血寒，積結胞門……在下，未多，經候不勻，令陰掣痛，少腹惡寒，或引腰脊，下根氣街，氣衝急痛，膝脛疼痛，奄忽眩冒，狀如厥顛，或有憂慘，悲傷多嗔，此皆帶下，非有鬼神。久則羸瘦，脈虛多寒，三十六病，千變萬端。”\n《諸病源候論·婦人雜病諸候》：“胞絡傷損，子臟虛冷，氣下衝則令陰挺出，謂之下脫。”\n“診其少陰脈浮動，浮則為虛，動則為悸，故令下脫也。”"
}