{
  "id": "shierefu",
  "number": 250,
  "name": "濕遏熱伏證",
  "category": "溫病證候",
  "overview": "濕遏熱伏證是指濕邪阻遏氣機，鬱熱不能宣散誘發，以發熱不甚，午後較顯，胸脘痞悶，苔白，舌絳為主症的證候。《外感溫熱篇》云：“若白苔絳底者，濕遏熱伏也，當先洩濕透熱，防其就乾也。”\n主要臨床表現為：頭痛，身重，發熱不甚，肢體困倦，胸脘痞悶，口不渴，納食呆滯，小溲黃赤，舌苔白而質絳，脈濡數。\n濕遏熱伏證常見於“濕溫”病中。\n本證應與“濕遏衛陽證”、“濕熱鬱阻脾胃證”、“暑兼寒濕證”相鑑別。",
  "clinical_manifestations": "頭痛，身重，發熱不甚，肢體困倦，胸脘痞悶，口不渴，納食呆滯，小溲黃赤，舌苔白而質絳，脈濡數。濕遏熱伏證",
  "common_diseases": [
    "“濕溫”病"
  ],
  "differential_syndromes": [
    "“濕遏衛陽證”",
    "“濕熱鬱阻脾胃證”",
    "“暑兼寒濕證”"
  ],
  "differential": {
    "self_analysis": "濕遏熱伏證系濕熱合邪，濕困熱外，熱處濕中的一種證候。濕邪鬱遏，清陽被阻，則見頭痛，身重；外濕引動內濕，脾氣失於運化，則見肢體重著困倦，口不渴；中焦升降失司，則見腹脹納呆；熱被濕遏，則發熱不甚，舌苔白而底絳，脈濡數。治當辛開苦降，洩濕透熱，方選王氏连朴饮(《霍乱论》)加減。\n本證多發於長夏初秋，此時溽暑蒸騰，人在氣交之中，濕邪困聚，氣機失宣，熱伏於里，即成濕遏熱伏之候。濕偏重者，濕阻氣機，影響脾胃升降，則會出現以脘腹脹滿，胸悶泛噁為主的證候；熱偏重者，熱蘊氣分，灼爍津液，則會出現以身熱煩渴，汗出溺短為主的證候。",
    "type_comparison": "濕遏衛陽證與濕遏熱伏證 二者均可見濕邪阻遏的發熱不揚，頭痛身重等。但濕遏衛陽證主要是濕熱之邪鬱於表衛，衛氣不得宣散，故身熱必兼惡寒，舌苔白膩，脈濡緩。而濕遏熱伏證則以濕鬱氣機，邪熱不得透達為其因，症見身熱胸痞，舌苔白而底絳，脈滑數。二者區別不難。\n濕熱鬱阻脾胃證與濕遏熱伏證 濕熱鬱阻太陰，運化失司所致的脘腹痞滿、納食呆滯為其共同點。但濕熱鬱阻脾胃證是太陰濕土內盛，陽明里熱鬱結，升降之機紊亂的證候。泛噁嘔吐，煩悶口渴，舌苔黃膩為其特點，與本證的口不渴，舌苔白不同。在治療上，彼證當化濕清熱，而本證則以洩濕透氣為法。\n暑兼寒濕證與濕遏熱伏證 暑兼寒濕證是夏月傷暑，復貪涼飲冷，外有寒濕鬱表，里有暑熱內鬱所致。而本證是由於濕阻氣機，熱為濕遏所形成。在臨床表現上，前者發熱重，口渴，苔黃膩；而後者熱不甚，口不渴，苔白膩。且後者無寒濕犯表的惡寒也是與前者的不同點。"
  },
  "literature": "《濕熱病篇》：“太陰內傷，濕飲停聚，客邪再至，內外相引，故病濕熱。”\n《濕熱病篇》：“濕熱證，胸痞發熱，肌肉微痛，始終無汗者，腠理暑邪內閉，宜六一散一兩，薄荷葉三四分，泡湯調下即汗解。”自注：“濕病發汗，昔賢有禁，此不微汗之，病必不除。蓋既有不可汗之大戒，復有得汗始解之治法，臨證者知所變通矣。”"
}