{
  "id": "ganyutanjie",
  "number": 148,
  "name": "肝瘀痰結證",
  "category": "臟腑證候",
  "overview": "肝瘀痰結證是指濕熱久羈，聚而生痰，氣滯血瘀，痰瘀互阻於肝而出現的證候。\n主要臨床表現為：脅下痞塊，脅肋刺痛，或脅下痞滿而痛，肝臟腫大，腹壁青筋暴露，納呆，厭油，咯吐痰涎，頭暈心悸，肢體沉重，舌質胖嫩，邊有齒痕，舌質暗或有瘀斑，苔膩，脈滑。\n肝瘀痰結證常見於“積聚”、“黃疸”、“脅痛”等病中。\n本證應與肝血瘀滯證、“疫毒瘀肝證”、肝氣鬱結證相鑑別。",
  "clinical_manifestations": "脅下痞塊，脅肋刺痛，或脅下痞滿而痛，肝臟腫大，腹壁青筋暴露，納呆，厭油，咯吐痰涎，頭暈心悸，肢體沉重，舌質胖嫩，邊有齒痕，舌質暗或有瘀斑，苔膩，脈滑。肝瘀痰結證",
  "common_diseases": [
    "“積聚”",
    "“黃疸”",
    "“脅痛”等病"
  ],
  "differential_syndromes": [
    "肝血瘀滯證",
    "“疫毒瘀肝證”",
    "肝氣鬱結證"
  ],
  "differential": {
    "self_analysis": "積聚病中見肝瘀痰結證，特點是：脘腹之內有成形結塊，固定不移，按之作痛，腹脹不舒，食少痰多，或皮下有瘀點，面色不華，舌質晦暗，或舌體胖，苔膩脈弦滑，證由濕熱邪毒留著，肝經氣機鬱滯，痰結瘀阻所致，治宜消積化痰，軟堅散結，方用宣明三棱汤(《宣明論方》)加減。黃疸病中見肝瘀痰結證，其特點是身目發黃，面色暗滯，目眶晦暗，伴肝臟腫大，刺痛，胸腹脹滿，肢體沉重痠困，乏力，納食減退，厭食油膩，噁心，多痰或咯痰量少，口渴不欲飲，此由濕熱久羈，化生痰濕，痰濁阻絡，血行不暢，遂成血瘀，終至痰濁瘀結，膠結不解，肝失疏洩，膽汁外溢而發病。治宜化瘀滌痰，方用涤痰汤(《濟生方》合失笑散(《和劑局方》)加減。脅痛病中見肝瘀痰結證，以脅下弦急刺痛，心下瘀塊，堅硬如盤，嘔惡痰多，舌質紫暗或有瘀斑，苔厚膩，脈弦澀為特點，治宜行氣化痰，活血祛瘀，方用导痰汤(《婦人良方》)合血府逐瘀汤(《醫林改錯》)加減；脅痛因肝氣鬱滯，痰熱按瘀者，臨床見脅肋脹滿疼痛，按之不舒，並可波及胃脘，厭食油膩，噁心噯氣，小便黃赤，大便粘滯不爽，舌質紫，舌苔白膩，脈弦，治宜疏肝達鬱，和營通絡，方用四逆汤(《傷寒論》)合瓜蒌散(《丹溪心法附條》)加減。脅痛因肝陰虧虛，夾有痰瘀者，臨床見肝區隱痛，或灼熱刺痛，稍有勞作肝痛即加重，形體日漸消瘦，精神疲憊，腰脛痠軟乏力，脘腹脹滿，或有低熱不退，夜寐不寧，口乾口粘不爽，面色晦暗，舌質暗紅，苔少，或稍膩，脈細澀，治宜滋陰清熱，化痰散瘀，方用一贯煎(《柳州醫話》)酌加化痰散瘀之品。痰瘀互阻，脅痛如錐如刺，甚則牽引腰背，伴見胸脘痞悶，欲嘔不爽，口乾口苦，小溲色黃，苔膩舌紫，脈弦而澀，治宜軟堅化瘀，方用三甲散(《溫疫論》)加減。\n本證病機為鬱怒傷肝，或土壅木鬱，肝失疏洩，氣滯不暢，水濕停聚，聚濕生痰，停滯日久，氣滯血瘀，痰瘀互結，或因嗜食肥甘，脾失健運，痰濁內生，阻遏肝臟，氣機不暢，日久脈絡瘀阻，痰瘀互結，肝臟腫大疼痛，或濕熱疫毒致肝病、肝病遷延，邪氣留著不去，而損傷肝臟功能。肝氣鬱滯，久則入絡，則血行瘀阻，濕濁困遏陽氣，熱邪或鬱火耗損陰血，最終導致肝、膽、脾、胃、心、腎等多臟功能失調，形成氣滯、血瘀、濕阻、熱鬱、氣陰虧虛等複雜證候，預後欠佳。",
    "type_comparison": "肝血瘀滯證與肝瘀痰結證 兩證多由肝氣鬱滯引起，都是病位在肝，都有肝血瘀阻脈絡，脅下痞塊，脹痛或刺痛，拒按，舌紫，或有斑點，苔膩，脈弦澀的表現，肝瘀痰結病較重，病程長，預後差，除肝血瘀阻的證候外，還可見體型肥胖，胸腹脹滿，肢體沉重痠困，乏力，納食減退，厭食油膩，噁心，多痰，或咯痰量少等痰濕阻滯的證候。\n疫毒瘀肝證與肝瘀痰結證 兩證都有肝血瘀阻表現，都是病位在肝，不同的是，疫毒瘀肝證具有顯著的傳染性，是典型的傳染性疾病，病情最終可發展為肝瘀痰結證。疫毒來自於外，疫毒入於血，瘀熱互結可見身黃如金，擾於血分，灼熱生風，內犯心包，而見煩躁、高熱、神昏、出血、抽搐等諸多變證，瘀熱久結脅下可見痞塊。肝瘀痰結證是因濕熱久羈，聚而生痰，氣滯血瘀，痰瘀互阻於肝而出現的證候，兩證均能見到脅下痞塊，脅肋刺痛或脅下痞滿而痛，肝臟腫大，腹壁青筋暴露，舌質暗或有瘀斑等肝血瘀阻證候，肝瘀痰結證還可見到納呆，厭油，咯吐痰涎，頭暈心悸，肢體沉重，舌質胖嫩，邊有齒痕苔膩，脈滑等症。\n肝氣鬱結證與肝瘀痰結證，兩證均由肝氣鬱結發展而來，都是病位在肝，均可見脅痛等證，不同的是肝氣鬱結證的脅痛為脹痛走審不定，時痛時止。肝瘀痰結證的脅痛多為刺痛，疼痛堅定不移，伴脅下腫塊，推之不移，局部壓痛，舌紫有瘀點，脈澀等瘀血證候，及體型肥胖，胸腹脹滿，肢體沉重痠困，乏力，納食減退，厭食油膩，噁心，多痰或咯痰量少，苔膩等痰濕內蘊證候。肝氣鬱結證病屬初起，易愈，肝瘀痰結證病屬晚期，難愈，預後差。"
  },
  "literature": "《丹溪心法》：“氣不能作塊成聚，塊乃有形之物也，痰與食積死血而成也。”\n《景岳全書》：“痰即人身之津液，無非水之所化，但化得其正，則形體健營衛充，而痰涎皆本氣血，若化失其正，則臟腑病，津液敗，而氣血即為痰涎。”\n《醫述》：“若先因傷血，血逆則氣滯，氣滯則生痰，與血相聚，名曰瘀血挾痰，患處按之痛而不移，其證或吐，或衄，或大便黑，其脈輕舉則滑，重按則澀，治宜導痰破血，先用導痰湯加蒼朮、香附、枳殼、白芥子開鬱導痰，次用芎、歸、桃仁、紅花、蘇木、丹皮、莪朮以破其血，若素有鬱痰，後因血滯，與痰相聚，名曰痰挾瘀血，患處痛而少移，其證或為脹悶，或為寒熱，其脈輕舉則芤，重按則滑，治宜先破其血，而後消痰，或消痰破血二者兼治。”\n《張氏醫通》：“痰挾死血，隨氣流注，流走刺痛。”\n“痰挾瘀血，遂成窠囊。”\n“瘀血久化為痰水。”"
}