{
  "id": "pixuganyu",
  "number": 151,
  "name": "脾虛肝鬱證",
  "category": "臟腑證候",
  "overview": "脾虛肝鬱證是指脾氣虛弱與肝氣鬱結同時存在的證候。本證或由脾氣虛弱，土虛木乘，致使肝氣鬱結；或由肝氣鬱結，木旺乘土，致使脾氣虛弱。故脾虛肝鬱證又稱“肝脾不調證”、“肝鬱脾虛證”。\n主要臨床表現為：腹脹便溏，納食減少，神疲乏力，肢體倦怠，胸脅脹滿，精神抑鬱或急躁易怒，善太息，舌淡苔白或膩，脈弦或緩弱。\n脾虛肝鬱證常見於“泄瀉”、“脅痛”、“腹痛”、“鬱證”、“月經不調”、“帶下”等疾病中。\n本證應與“脾氣虛證”、“肝氣鬱結證”相鑑別。",
  "clinical_manifestations": "腹脹便溏，納食減少，神疲乏力，肢體倦怠，胸脅脹滿，精神抑鬱或急躁易怒，善太息，舌淡苔白或膩，脈弦或緩弱。脾虛肝鬱證",
  "common_diseases": [
    "“泄瀉”",
    "“脅痛”",
    "“腹痛”",
    "“鬱證”",
    "“月經不調”",
    "“帶下”"
  ],
  "differential_syndromes": [
    "“脾氣虛證”",
    "“肝氣鬱結證”"
  ],
  "differential": {
    "self_analysis": "脾虛肝鬱證可見於多種疾病中，其臨床表現特點是脾氣虛弱與肝氣鬱結並見。如泄瀉病中出現脾虛肝鬱證，則以腹痛即瀉，瀉後痛減，每因抑鬱惱怒或精神緊張而誘發，平素胸脅脹滿，納少腹脹，神疲乏力為特點。此由土虛木乘，或木旺乘土，運化失司，清濁不分所致。治宜抑肝扶脾，方用痛瀉要方(《丹溪心法》)。脅痛病中出現本證，則以脅痛時作時止，口苦，納少，腹脹，便溏，疲乏為特點。此由肝鬱氣滯，脾失健運，濕濁內生，肝絡失和所致。治宜疏肝理氣，健脾除濕，方用柴胡疏肝散(《景岳全書》)合胃苓湯(《丹溪心法》)加減。若在腹痛病中出現脾虛肝鬱證，則以腹痛綿綿，時作時止，痛時喜按，飢餓及勞累後更甚，得食得溫後稍減，大便溏薄，神疲，氣短，怯寒為特點。多由肝鬱氣滯，橫逆犯脾，脾虛不運，氣血生化不足，經脈失養所致。治宜疏肝健脾，溫中散寒，方用柴胡疏肝散合小建中湯(《金匱要略》)加減。在鬱證病中出現脾虛肝鬱證，則以精神抑鬱，胸悶脅痛，納少腹脹，大便溏薄為特點。此多因情志不遂，肝鬱脾虛，升降失司，氣血不和所致。治宜疏肝解鬱，健脾和營，方用逍遙散(《和劑局方》)。若在月經不調病中出現脾虛肝鬱證，則以經期先後無定期，經量或多或少，色淡或暗，有塊，胸脅、乳房脹痛，小腹脹墜，納少便溏，神疲乏力為特點。此由肝鬱氣滯，脾虛血少，衝任失調所致。治宜疏肝健脾，養血調經，方用逍遙散加減。若在帶下病中出現脾虛肝鬱證，則以帶下量多，色白或黃，質稠無臭，綿綿不斷，神疲乏力，納少便溏，面色萎黃為特點。此由肝鬱脾虛，濕濁下注所致。治宜疏肝健脾，除濕止帶，方用完帶湯(《傅青主女科》)。\n脾虛肝鬱證，脾病在氣，肝病亦在氣，故其病變部位主要在脾肝氣分。在病機演變過程中，若肝鬱化火，可致肝火犯胃，出現嘔吐吞酸，嘈雜，口苦口乾等症；若脾虛濕盛，濕鬱化熱，可致濕熱蘊結，出現黃疸，身熱，小便短赤等症；若氣滯血瘀，可致癥瘕積聚，出現腹中包塊，疼痛拒按等症。",
    "type_comparison": "脾氣虛證與脾虛肝鬱證 脾氣虛證以脾氣不足，運化失職為主要病機，臨床表現為納少，腹脹，便溏，肢倦，神疲，少氣懶言，面色萎黃，舌淡苔白，脈緩弱等。脾虛肝鬱證除具備脾氣虛證的臨床表現外，尚有肝氣鬱結的症狀，如胸脅脹滿，精神抑鬱或急躁易怒，善太息，脈弦等。二者鑑別的關鍵在於有無肝氣鬱結的表現。\n肝氣鬱結證與脾虛肝鬱證 肝氣鬱結證以肝氣鬱結，氣機阻滯為主要病機，臨床表現為胸脅脹滿疼痛，精神抑鬱，善太息，或咽中異物感，或頸部癭瘤，或癥瘕積聚，舌苔薄白，脈弦。脾虛肝鬱證除具備肝氣鬱結證的臨床表現外，尚有脾氣虛弱的症狀，如納少，腹脹，便溏，肢倦，神疲等。二者鑑別的關鍵在於有無脾氣虛弱的表現。"
  },
  "literature": "《醫宗金鑑·刪補名醫方論》：“治肝不調脾，則非其治也。”\n《葉氏女科證治·調經》：“肝鬱脾虛，其症胸脅脹滿，飲食減少，四肢倦怠，月經不調，或崩漏，或帶下。治宜疏肝健脾，逍遙散主之。”"
}