{
  "id": "weifen",
  "number": 34,
  "name": "衛分證",
  "category": "基礎證候",
  "overview": "衛分證是指風熱之邪，自口鼻或皮毛而入，致使肺失宣散，衛氣被阻而出現以發熱，微惡風寒，咳嗽而渴，脈浮數為主症的證候。《外感溫熱篇》曰：“溫邪上受，首先犯肺。”故又稱“溫邪犯肺證”或“風熱犯肺證”。\n主要臨床表現為：發熱頭痛，微惡風寒，有少許汗或無汗，咳嗽，口微渴，咽痛，苔薄白，脈浮數。\n衛分證常見於：“風溫”、“感冒”、“麻疹”等疾病中。\n本證應與“風寒犯肺證”、“溫燥犯肺證”、“濕遏衛陽證”、“暑熱犯肺證”相鑑別。",
  "clinical_manifestations": "發熱頭痛，微惡風寒，有少許汗或無汗，咳嗽，口微渴，咽痛，苔薄白，脈浮數",
  "common_diseases": [],
  "differential_syndromes": [],
  "differential": {
    "self_analysis": "衛分證是風熱之邪客於肺衛所致，常見於各種外感熱病的初起病變中。例如風溫病初起，多因風熱襲表，或風邪犯肺而見本證，若風熱襲表，衛氣被阻，肺氣失宜，皮毛受邪，症見發熱，微惡風寒，少汗或無汗，咳嗽，口微渴，苔薄白，脈浮數，治宜辛涼解表，方選辛涼平劑銀翹散(《溫病条辨》)；若風邪犯肺，肺失宣散，邪未化熱，病勢較輕，全身症狀還不明顯，症以咳嗽為主，且見頭脹，身不甚熱，口微渴，苔薄，脈浮等象者，治宜辛涼解表，方選辛涼輕劑桑菊飲(《溫病条辨》)。又如感冒亦可見本證，尤以時行感冒更為突出，其發病快，且有傳染性，男女老少皆可罹病，全身症狀較為明顯，症見發熱，惡風寒，頭痛，鼻塞流涕，咳嗽咽痛，苔薄黃，脈浮數。由於風熱之邪客於肺衛，正邪相爭，肺失宣肅所致，治宜清熱解毒，祛風解表，方選銀翹散或荊防敗毒散(《外科理例》)加減。又如麻疹初起亦可見本證，此系麻毒犯肺，肺衛失宣，邪熱壅阻，氣道不利，症見發熱惡寒，咳嗽噴嚏，兩眼流淚而畏光，身出紅疹，自耳後、頸部，漸漫及顏面、軀體、四肢、苔薄膩，脈浮數，治宜辛涼透表，方選升麻葛根湯(《閻氏小兒方論》)。\n衛分證為冬春季最常見的疾病，因春季氣候溫暖而多風，風溫之邪每易襲犯肺衛，形成本證；若逢冬季氣候應寒而反溫，不至而至，風溫外襲，客於肺衛；或素體陽氣不足，稟賦虛弱感受風熱，均可發為本證。\n本證在疾病的演變過程中，可出現多種兼夾證，若兼夾濕濁，可見發熱咳嗽，胸悶，舌苔白膩，痰多等；若兼夾熱邪，多為肺胃素有蘊熱，則可見咳嗽，咽痛口乾，心煩，齒痛齦腫，舌紅苔黃等；若兼夾瘀阻肺絡，則可見發熱咳嗽，胸痛，或咳咯血塊，舌瘀紫等；若肺熱津虧陰虛者，症見發熱乾咳，咽疼，氣短，咯血，口渴，舌紅苔少等；若肺移熱於大腸，則可兼見便秘，或泄利。本證可由衛分而轉入氣分，症見壯熱，氣粗而喘；亦可因熱入營分，而見舌絳，神昏，斑疹隱隱；或熱入血分，陰津耗竭，而見舌絳無苔，外發斑疹，神昏，手足瘛瘲等。",
    "type_comparison": "風寒犯肺證與衛分證 二者均為表證，且都有發熱，惡寒，咳嗽，頭痛，脈浮的症狀。但風寒犯肺證是因外感風寒之邪，寒邪束表，客於肺衛，肌膜閉塞，營衛不和，症見發熱惡寒，頭痛，無汗，骨節痠痛，咳嗽，鼻流清涕，痰涎稀白，苔白，脈浮緊。與本證的鑑別在于：一、風寒犯肺證主要是感受寒邪，本證主要是感受溫邪。二、風寒犯肺證有明顯的寒象，且肌膜閉塞，可見鼻塞流涕，咳嗽，痰涎稀白，身痛，骨節痠楚，惡寒無汗。而本證有明顯的熱象，且肌腠疏鬆，可見咳嗽，咽痛，痰黃，口微渴，有少許汗，微惡風寒。前者脈浮緊，後者脈浮數。三、風寒犯肺證宜用辛溫之劑以祛風散寒，宣肺解表，本證宜用辛涼之劑以疏風清熱，宣肺解表。\n溫燥犯肺證與衛分證 二者均為外邪侵襲肺衛的表證，且都有發熱，微惡風寒，頭痛，咳嗽，少汗的症狀。但溫燥犯肺證是為秋令感受溫燥之氣，邪襲肺衛，燥熱傷津所致，不僅可見上述共同的邪犯肺衛的症狀，還可見燥邪犯肺傷津的症狀，如咳嗽少痰，口渴，鼻燥，咽乾等。與本證的鑑別在于：一、溫燥犯肺證多發於秋令，且有燥熱傷津的病機。而本證多發於春冬二季，主要為風温之邪犯肺。二、前者溫燥兩氣互為因果，熱邪化燥，燥氣生熱，燥熱爍津，津少失潤，故有明顯的口渴，鼻燥，咽乾的表現。本證只有肺衛熱象，而無燥象，故見口微渴，咽痛。三、前者治以辛涼甘潤，宣肺透邪，本證治以辛涼宣解。\n濕遏衛陽證與衛分證 二者均有外邪侵襲表衛的發熱惡寒，頭痛，口渴症狀。但濕遏衛陽證是濕溫之邪，侵襲肌表，衛氣不宜所致，症見先惡寒，後發熱，身熱不揚，頭痛且重，首如裹，肢體困重，胸悶，口渴不欲飲，苔膩，脈濡。與本證的鑑別在于：一、濕遏衛陽證是感受濕溫之邪，多發於長夏，而本證是感受風溫之邪，多發於冬春季。二、前者有明顯的濕阻表衛特點，如始惡寒，後發熱，身熱不揚，首如裹，而本證主要為溫邪客於表衛，故見發熱，微惡風寒，頭痛。三、前者有濕邪粘膩而重著的表現，可見胸悶，肢體困重，口渴不欲飲，苔膩，脈濡，而後者有熱邪犯肺的表現，可見咳嗽，口微渴，脈浮數。四、前者治以芳香宣透，後者治以辛涼解表。\n暑熱犯肺證與衛分證 二者均可見熱邪犯肺而出現的身熱，咳嗽，口渴等症狀。但暑熱犯肺證是冒受暑熱，侵犯肺經所致，症見發熱，口渴，咳逆無痰，胸悶脅痛。與本證的鑑別在于：一、暑熱犯肺證為冒受暑邪，多發於夏季，本證是為風温犯肺，多發於冬春季。二、暑熱犯肺證是肺受暑熱之邪的輕症，故見發熱口渴，咳逆無痰，胸悶脅痛的肺部症狀，而本證是溫邪侵襲肺衛，不僅有肺部的咳嗽，咽痛症狀，且有明顯的衛氣不和症狀，如發熱，微惡風寒，汗出等。三、暑熱犯肺證治宜清熱宣肺，本證治宜辛涼解表。"
  },
  "literature": "《溫病条辨·上焦篇》：“蓋傷寒之邪留戀在表，然後化熱入里，溫邪則熱變最速。未傳心包，邪尚在肺，肺主氣，其合皮毛，故云在表，在表初用辛涼輕劑。”\n《外感温熱篇》王孟英注：“溫邪始從上受，病在衛分，得從外解，則不傳矣。”\n《外感温熱篇》章虛谷注：“傷寒邪在太陽，必惡寒甚，其身熱者，陽鬱不伸之故，而邪未化熱也。傳至陽明，其邪化熱則不惡寒，始可用涼解之法，若有一分惡寒，仍當溫散。蓋以寒邪陰凝，故須麻桂猛劑，若溫邪為陽，則宜輕散，倘重劑大汗而傷津液，反化燥火，則難治矣。始初解表用辛涼，須避寒凝之品，恐遏其邪，反不易解也。”\n《溫病条辨·上焦篇》：“太陰之為病，脈不緩不緊而動數，或兩寸獨大，尺膚熱，頭痛，微惡風寒，身熱自汗，口渴，或不渴而咳，午後熱甚者，名曰溫病。”\n《外感溫病篇》：“風温為病，春月與冬季居多，或惡風或不惡風，必身熱咳嗽煩渴，此風溫證之提綱也。”“風温證，身熱畏風，頭痛咳嗽，口渴，脈浮數，舌苔白者，邪在表也。當用薄荷、前胡、杏仁、桔梗、桑葉、川貝之屬，涼解表邪。”"
}