{
  "id": "zao",
  "number": 24,
  "name": "燥證",
  "category": "基礎證候",
  "overview": "燥證是指由於感受外界燥邪,或體內津傷液耗,使機體津液不足,各組織器官和孔竅失其濡潤,而出現乾燥枯澀的證候。在病因中,燥邪為秋季主氣,六淫之一,感染多從口鼻而入,侵犯肺衛,易傷津液及肺臟稱為外燥病證;內燥證則為體內陰津耗傷而出現乾燥的證候,多由熱盛津傷,或汗、吐、下後傷亡津液,或亡血失精,或久病精血內奪等原因引起,臨床多以“津虧”、“血燥”為表現。燥邪為病又有溫燥、涼燥之分,證候偏熱的為溫燥,偏寒的為涼燥。\n主要臨床表現為:皮膚乾燥皸裂,口鼻乾燥,咽乾口渴,乾咳少痰,或痰中帶血,大便乾結,小便短少,唇焦,舌乾無津;甚則潮熱心煩,皮膚乾澀粗糙,毛髮乾枯不榮,肌肉消瘦,腰膝痠軟,遺精盜汗,舌乾紅無苔,脈細數而弱。\n燥證常見於“咳嗽”、“肺癆”、“咳血”、“胃痛”、“噎膈”、“便秘”、“消渴”、“痿證”等病證中。\n本證應與“火熱證”、“暑證”、“陰虛證”、“血虛證”等相鑑別。",
  "clinical_manifestations": "皮膚乾燥皸裂,口鼻乾燥,咽乾口渴,乾咳少痰,或痰中帶血,大便乾結,小便短少,唇焦,舌乾無津;甚則潮熱心煩,皮膚乾澀粗糙,毛髮乾枯不榮,肌肉消瘦,腰膝痠軟,遺精盜汗,舌乾紅無苔,脈細數而弱。燥證",
  "common_diseases": [
    "“咳嗽”",
    "“肺癆”",
    "“咳血”",
    "“胃痛”",
    "“噎膈”",
    "“便秘”",
    "“消渴”",
    "“痿證”等病證"
  ],
  "differential_syndromes": [
    "“火熱證”",
    "“暑證”",
    "“陰虛證”",
    "“血虛證”"
  ],
  "differential": {
    "self_analysis": "燥邪致病,分外燥、內燥兩類。外燥證由感受外界燥邪而發病,多從口鼻而入,首犯肺衛,易傷津液,症見皮膚乾燥皸裂,口鼻乾燥,咽乾口渴,乾咳少痰或痰中帶血等。津傷化燥則發為內燥證,由於津液虧少,不足以內溉臟腑,外潤腠理孔竅,從而燥熱便由內而生,故臨床多見津液枯涸、乾燥失潤等病變,即《素問·陰陽應象大論》說:“燥勝則干”,劉完素也認為:“諸澀枯涸,干勁皲揭,皆屬於燥”。因感受燥邪及臟腑組織津傷部位不同,則發病的臨床表現也各異。如風燥傷肺,肺失宣肅清潤,則見咳嗽,症見乾咳,連聲作嗆,喉癢,咽喉乾痛,唇鼻乾燥,無痰或痰少而粘,不易咯出,或痰中帶有血絲,口乾欲飲,初起或伴有鼻塞,頭痛,惡風,身熱等表證,舌質紅,苔薄白或薄黃,乾而少津,脈浮數或小數,治宜疏風清肺,潤燥止咳,方用桑杏湯(《溫病條辨》)加減;另有涼燥證,乃燥證與風寒並見,治宜溫潤止咳,散寒解表,方用杏蘇散(《溫病條辨》)加紫菀、款冬、百部、荊芥、防風。若“癆蟲”犯肺,損傷肺體,陰虛肺燥,乃成肺癆,症見乾咳,咳聲短促,痰中有時帶血絲,色鮮紅,午後手足心熱,皮膚下灼,或有盜汗,口乾咽燥,胸部隱痛,苔薄,邊尖質紅,脈細或兼數,治宜滋陰潤肺,方用月華丸(《醫學心悟》)加減。如感受風熱燥邪,損傷肺絡,肺失清肅,則發為咳血,症見喉癢咳嗽,痰中帶血,口乾鼻燥,或有身熱,舌紅,少津,苔薄黃,脈數,治宜清熱潤肺,寧絡止血,方用桑杏湯(《溫病條辨》)加白茅根、藕節、茜草、側柏葉。如胃熱鬱久傷陰耗液,胃燥而失於濡養,則成胃痛,症見胃痛隱隱,口燥咽乾,大便乾結,舌紅少津,少苔,脈細數,治宜養陰益胃,潤燥止痛,方用玉女煎(《景岳全書》)合用芍藥甘草湯(《傷寒論》)。如恣食辛香燥熱之品,胃陰虧耗,津傷血燥,食道失於濡潤,咽管乾澀,則成噎膈,症見吞嚥梗塞而痛,固體食物難進,形體逐漸消瘦,口乾咽燥,大便乾結,五心煩熱,舌乾而紅,或有裂紋,脈弦細數,治宜滋養津液,方用五汁安中飲(驗方)加味。若過食辛熱厚味,以致胃腸積熱,或熱病餘邪留戀,津液耗傷,腸道失潤,大便乾結,難以排出而為便秘,症見大便乾結,小便短赤,面紅身熱,口乾口臭,舌紅苔黃或黃燥,脈滑數,治宜清熱潤腸,方用麻子仁丸(《傷寒論》)。如素體陰虛,飲食不節,復因情志失調,勞欲過度,而使肺、胃、腎出現陰虛燥熱諸證,此為消渴,證治詳見“火熱證篇 本證辨析”。如脾胃素虛,外感濕熱,使肺胃精津耗傷,肺燥筋脈失於濡養,而產生痿證,症見病起發熱,後突然出現肢體軟弱無力,皮膚枯燥,心煩口渴,咳嗆少痰,咽乾不利,小便黃少,大便乾燥,舌紅苔黃,脈細數,治宜清熱潤燥,養肺生津,方用清燥救肺湯(《醫門法律》)加減。\n陰津虧損,或實熱傷津均可致燥熱內生。內燥病變可發生於各臟腑組織,綜前所述,以肺、胃、肝、腎及大腸為多見。如以肺燥為主,除有津液枯涸的陰虛內熱表現外,還可見乾咳無痰,甚則咯血;以胃燥為主時,則胃陰虧虛,可見胃痛隱隱,舌光紅無苔;如肝腎陰虛而燥,則見筋脈失濡,目澀,脅痛等表現;若系腸燥,則有便秘之症。燥邪侵犯人體後,其轉歸與其性質和致病特點密切相關,不外乎津液耗傷,肺胃等臟腑功能失調,導致臟腑筋脈、皮膚孔竅等組織器官失於濡潤,津虧燥熱變證百出。",
    "type_comparison": "火熱證與燥證 二證都為易傷津液之證,均可出現口渴喜飲,咽乾舌燥等候。但二者仍有眾多不同之處,燥證偏於乾澀傷津,火熱證則偏於炎上燔灼,其鑑別要點如下:一、從病因而言,燥為秋季主氣,性干澀,根據初秋、深秋之不同,可分為溫燥和涼燥;火熱證則無季節限制,五氣、五志皆可化火。二、從病機而言,燥邪多從口鼻而入,侵犯肺衛,損傷肺津,乃至全身陰津虧耗,臟腑組織失於濡潤;而火熱之邪除可耗氣傷津外,還可傷風動血,腐蝕血肉、擾亂心神等。三、從臨床症狀而言,燥證以出現乾澀津傷的臨床表現為特點,症見口鼻乾燥,咽乾口渴,乾咳少痰,痰粘難咯,或痰中帶血,皮膚乾澀,甚至皲裂,毛髮不榮,大便乾結,故《素問·陰陽應象大論》說:“燥勝則干”;面火熱證則以陽熱炎上燔灼為臨床表現特點,多見高熱,惡熱,煩渴,汗出,脈洪數等症,如火熱陽邪上擾神明,可出現心煩失眠,狂躁妄動,神昏譫語;如火邪燔灼肝經,耗竭陰液,筋脈失於濡養,可見高熱神昏,四肢抽搐,角弓反張;如熱灼脈絡,迫血妄行,則可見各種出血症狀;如火熱之邪入於血分,熱壅血瘀於局部,則發為癰腫瘡瘍。由此可鑑別二證。\n暑證與燥證 二證都以耗傷津液為特點,均可出現口渴喜飲,小便短少等津傷症狀。但燥證由秋季燥邪侵襲,或體內津傷液耗,產出內燥而致;暑證則有明顯季節性,純由暑邪為患。燥邪多從口鼻而入,侵犯肺衛,最易損傷肺津,終至全身陰津虧虛,臟腑組織失於濡潤;暑邪傷入,多直入氣分,耗氣傷津,並常挾濕為患。燥證主要以干澀,津傷,液虧為臨床表現特點,而暑證雖也可出現耗氣傷津之證,但仍主要以炎熱升散為重。\n陰虛證與燥證 二證都為陰液不足之證候,均可見咳嗽咯痰,痰中帶血,咽乾口渴,大便乾結,身熱舌乾等臨床表現。陰虛證多因先天虧損,久病勞損而精血不足,或熱病後陰液耗傷所致,症見形体消瘦,口燥咽乾,潮熱盗汗,五心煩熱,午後顴紅,尿少色黃,大便乾結,舌紅少苔,脈細數。燥證多由感受外界燥邪,或體內津液耗傷而致,症見皮膚乾燥皲裂,口鼻乾燥,咽乾口渴,乾咳少痰,小便短少,大便乾結,唇焦,舌乾無津等。燥證所致的津液不足可西一步發展為陰虛證。燥證主要以干澀津傷為臨床特點;而陰虛證則以陰不制陽,陰虛火旺之象為辨證要點。明瞭其要,二證不難鑑別。\n血虛證與燥證 血虛證進一步發展,可出現體內精血虧奪,機體失於滋潤的血燥、內燥表現,症見口燥咽乾,皮膚乾澀粗糙,起鱗屑,瘙痒,毛髮乾枯不榮,大便秘結,小便短少,舌紅苔乾,脈弦細數等,故二證關係密切。但在病因病機、臨床表現方面,二者亦有一定區別。血虛證多由失血過多,或脾胃虛弱生化不足,以及情志內傷,化火傷陰而致,症見面色蒼白或萎黃,唇色淡白,頭暈眼花,心悸失眠,手足發麻,舌質淡,脈細無力等,其中以體表肌膚蒼白不榮及全身虛弱為鑑別要點。而燥證則以干澀,津液不能濡潤為其臨床特徵,除可存在血虛證見外,又有以乾燥為主的症狀。二證明顯不同,可予鑑別。"
  },
  "literature": "《脾胃論·卷下·脾胃損在調飲食適寒溫》:“治飲食勞倦,大便秘澀,或乾燥閉塞不通,全不思食,乃風結、血結,皆能閉塞也。潤燥,和血,疏風,自然通利也。”\n《景岳全書·咳嗽篇》:“內傷之嗽,必起於陰分,蓋肺屬燥金,為水之母,陰損於下,則陽孤於上,水涸金枯,肺苦於燥,肺燥則癢,癢則咳不能已也。”"
}