{
  "id": "yinxuxuezao",
  "number": 65,
  "name": "陰虛血燥證",
  "category": "全身證候",
  "overview": "陰虛血燥證指陰液虧虛，津血被耗，以口乾咽燥，皮膚乾澀或甲錯，毛髮不榮，潮熱盗汗等為主要表現的證候，多因外感熱邪，日久傷陰，或年老體虛，或縱欲過度所致。\n主要臨床表現為：頭暈目眩，口乾咽燥，皮膚乾澀，瘙痒或甲錯，毛髮不榮，午後潮熱，盗汗顴紅，舌質紅，少津，脈細數等。\n陰虛血燥證常見於“痿病”、“便秘”、“噎膈”、“耳鳴耳聾”、“燥病”等疾病中。\n本證通常應與“血熱化燥證”、“陰虛血熱證”、“熱傷氣陰證”相鑑別。",
  "clinical_manifestations": "頭暈目眩，口乾咽燥，皮膚乾澀，瘙痒或甲錯，毛髮不榮，午後潮熱，盗汗顴紅，舌質紅，少津，脈細數等。陰虛血燥證",
  "common_diseases": [
    "“痿病”",
    "“便秘”",
    "“噎膈”",
    "“耳鳴耳聾”",
    "“燥病”"
  ],
  "differential_syndromes": [
    "“血熱化燥證”",
    "“陰虛血熱證”",
    "“熱傷氣陰證”"
  ],
  "differential": {
    "self_analysis": "陰虛血燥證可見於多種疾病之中，因其病因，病位不同，故臨床表現各異。若在痿病之中，多因素體腎虛，或因房室太過，乘醉入房，精損難復，或因勞役太過，罷極之本傷，肝腎虧虛，精血不能濡養筋骨經脈，漸成痿病，臨床起病緩慢，腰背痿軟，下肢無力，不能久立，目眩髮落，咽乾耳鳴，甚者步履全廢，腿脛大肉漸脫，舌紅少苔，脈細數，治宜補益肝腎，滋陰養血，方用虎潛丸(《丹溪心法》)。若於便秘中，見此證者，多因病後，產後以及年老體衰之人，津枯血虛，真陰一虧，則腸道失潤而更行乾槁，症見頭暈目眩，面色無華，大便秘結如羊屎，心悸，口乾唇燥，心煩少寐，潮熱盗汗，腰膝痠軟，脈細澀，治宜滋陰養血，潤燥通便，方用尊生润肠丸(《沈氏尊生书》)合增液汤(《溫病条辨》)。如在噎膈中見陰虛血燥證，多為年老體虛，或色欲太過，陰血虛竭，諸臟受累，腎精虧耗，脾胃化源告竭，陰傷血燥，食管失養，乾澀枯澀而發此病。《金匱翼·噎膈》曰：“噎膈之病，大都年逾五十者，是津液枯槁者居多。”《景岳全書·噎膈》說：“酒色過度則傷陰，陰傷則精血枯涸，氣不行則噎膈病於上，精血枯涸則燥結於下。”或熱毒之邪傷陰耗血，食管失於濡潤，亦可發病；其臨床表現為吞嚥梗澀而痛，食物難入，食下復出，水可下入，胸背灼痛，形體消瘦，肌膚枯燥，口咽乾燥，脘中灼熱，欲飲涼水，潮熱盗汗，五心煩熱，大便乾結，舌紅而乾，或有裂紋，脈弦細數，治宜滋陰養血，瀉熱散結，方用启膈散(《醫學心悟》)若在耳鳴耳聾之中見此者，多為素體不足，精血虧少，或恣情縱欲，致使腎精耗傷，陰虛血燥，引發本病，耳為腎之外竅，為十二經脈所灌注，內通於腦，腎者藏精而主髓，腎精充沛，髓海而濡，則聽覺正常，若腎精虧耗，陰虛血燥，髓海空虛，不能上濡清竅而發耳鳴及耳聾，臨床表現耳鳴、耳聾，面色無華，口乾渴，肌膚乾燥，頭暈目眩，腰痠遺精，舌紅，脈弦細，治宜益腎養血，方用耳聾左慈丸(《小兒藥證直诀》)合四物汤(《和劑局方》)。若在燥病中見此證，則多為素體陰虛，或久病陰虛內燥，或感染邪毒而致津液生化不足，或傷陰耗血，清竅關節失養所致。症見兩目乾澀，少淚，鼻燥或鼻衄，乾咳少痰或咯血，咽乾喉癢，口渴欲飲，皮膚乾燥，大便乾結，關節腫痛，舌乾少津，苔薄黃，脈浮緩，治宜滋陰清熱，養血潤燥，方用增液汤(《溫病条辨》)合六味地黄丸(《小兒藥證直诀》)。\n陰虛血燥證者多素來腎虛，或因房室太過，乘醉入房，精損難復，或因勞役太過，罷極之本傷，或熱病傷陰耗血，陰精虧損，筋脈失其營養而發病，尤以溫熱病之後期，最易灼陰動血，而常發為此證。",
    "type_comparison": "血熱化燥證與陰虛血燥證 兩者均有傷津化燥之象，臨床表現均有口乾咽燥，大便秘結，形體消瘦，口渴，脈細數。但其病因病機又各有所不同，血熱化燥證多因熱邪深入血分，傷陰化燥，其熱勢重，化燥輕，還表現為身熱夜甚，渴不多飲，神昏譫語，小便短少或尿血，便秘或便血，吐衄發斑，舌絳少苔少津等血熱症狀。陰虛血燥證者，多因素體陰虛，或房勞太過，也可因熱傷陰血，致使出現陰傷血虧，筋脈失榮養而發病，陰虛血燥證，其熱勢輕，陰虛重，此與血熱化燥不同，兩者可以區別，但血熱化燥證傷陰進一步加重，而發展到陰虛血燥證。\n陰虛血熱證與陰虛血燥證 兩者均有陰虛之證，血分為病，但其所不同的是一為血熱，一為血燥。陰虛血熱證是指陰液虧虛，虛熱迫血，除陰虛的臨床表現以外，還有咳血、吐血、齒衄、鼻衄、尿血、斑疹等血熱妄行的表現。陰虛血燥是指陰液虧虛，津血被耗，除陰虛的臨床表現外，還有皮膚乾澀，瘙痒，或肌膚甲錯，毛髮不榮，眼眶深陷，四肢痿軟等血燥之象，此與血熱化燥證不同，兩者可以鑑別。\n熱傷氣陰證與陰虛血燥證 兩者均有傷陰的臨床表現並且可見於溫病後期。熱傷氣陰證是指溫病之中，溫邪里傳，傷津耗氣，以身熱已退或不退，汗多或不止，口渴舌燥，肢體倦怠無力，精神疲憊，心煩尿黃，甚至喘促欲脫，脈虛大無力或散大，舌苔薄而乾，或舌淡紅無苔或乾而色不榮或齒垢如灰糕樣等，此證既有陰虛，又有氣虧，乃氣陰兩虧之證，非獨陰血不足，與血熱化燥證不同，可資鑑別。"
  },
  "literature": "《靈樞·玉版》“咳，脫形，身熱，脈小以疾。”\n《肘后備急方·治屍注鬼注方》“累年積月，漸就屯滯，以至於死，死後復傳旁入乃至天門。”\n《諸病源候論·骨注候》“……令人氣血減耗，肌肉消盡，骨髓間時噴喻而熱，或……而汗，柴瘦骨立”。\n《景岳全書·噎膈》“酒色過度則傷陰，傷陰則精血枯涸，氣不行則噎膈病於上，精血枯涸則燥結於下。”\n《金匱翼·膈噎》“噎膈之病，大都年逾五十者，是津液枯槁者居多”。\n《雜病源流犀燭·大便秘結源流》：“大便秘結，腎病也。經曰：北方黑水，入通於腎，開竅於二陰，蓋此腎主五液，津液盛，則大便調和。”"
}